http,{H1L6-S4SR77TG-2494AQKO},12/29/2010 08:26:16,SNK1280,PC-3271,http://simplyhired.com/WboUhagvat57469130.jsp,Job Hunting,job opening develop develop on-time start skills opening years start technologies recruiter responsibilities passion guidance team opening contribute resume multiple industry responsibilities degree team team multiple multiple develop sales responsibilities guidance concepts skills process initiative develop job strong job permanent technologies resume responsibilities platform benefits degree dynamic required process
http,{X2G2-V2PC38LF-8647EHLX},12/29/2010 08:39:30,SNK1280,PC-3271,http://lockheedmartin.com/WboUhagvat1636367808.htm,Job Hunting,opening responsibilities years resume experience resume guidance industry opening equivalent visual customer benefits visual start process develop sales multiple interface on-time skills process people salary recruiter multiple passion relocation dynamic guidance starter responsibilities customer responsibilities team on-time degree responsibilities develop job expert growth equivalent platform sales benefits strong growth technologies report develop resume resume job skills start technologies years guidance multiple technologies management permanent years degree experience visual
http,{L9U7-Q5OJ71OC-4149FVUR},12/29/2010 08:52:36,SNK1280,PC-3271,http://monster.com/WboUhagvat1180707852.html,Job Hunting,dynamic experience expert years strong engineer job platform team growth job strong benefits contribute experience required part-time permanent permanent multitask required years customer sales visual people interface passion industry starter resume initiative multiple platform hours degree initiative hours dynamic management multiple skills platform responsibilities skills hours people salary degree compensation responsibilities
email,{Q9P4-U6AG48PB-1256HZVY},12/29/2010 09:33:14,SNK1280,PC-3271,Mack-Tyrone@northropgrumman.com,,,Sarah.Natalie.Knox@dtaa.com,Send,27171,,Job Hunting,skills hours concepts interface equivalent analyze interface resume years on-line degree multiple analyze industry initiative on-time expert interface industry on-time experience platform equivalent interface degree compensation people expert industry interface opening on-time responsibilities interface report dynamic skills
http,{R9W4-I3VC99XV-0718MBLW},12/29/2010 09:45:32,SNK1280,PC-3271,http://monster.com/WboUhagvat1180707852.html,Job Hunting,recruiter people expert years benefits platform people concepts benefits opening years required experience sales benefits technologies platform years initiative growth degree call experience permanent interface multitask concepts customer hours benefits develop experience contribute passion years permanent passion skills contribute years resume
http,{L2U8-B3KN89KS-8987KQGN},12/29/2010 11:20:28,SNK1280,PC-3271,http://lockheedmartin.com/WboUhagvat1636367808.htm,Job Hunting,develop permanent expert multiple multiple job opening degree strong multitask multiple responsibilities permanent technologies passion call opening required growth industry dynamic management job initiative multitask platform dynamic equivalent equivalent equivalent interface industry recruiter multiple hours years strong skills compensation initiative customer salary degree part-time required multitask start concepts responsibilities guidance
http,{Z2S1-X9JK22QP-5255KYWD},12/29/2010 12:59:28,SNK1280,PC-3271,http://lockheedmartin.com/WboUhagvat1636367808.htm,Job Hunting,customer start team passion concepts sales passion growth experience contribute dynamic benefits expert job required experience dynamic skills team hours platform opening guidance guidance team skills opening resume platform concepts equivalent resume multiple responsibilities multitask contribute guidance skills required responsibilities hours customer part-time responsibilities customer multitask
http,{G2T8-I3ST73FP-1394XJEJ},12/29/2010 13:02:01,SNK1280,PC-3271,http://monster.com/WboUhagvat1180707852.html,Job Hunting,multiple multitask report process people multitask permanent job responsibilities sales job people hours starter compensation years growth people equivalent guidance platform multiple contribute passion equivalent growth team part-time industry equivalent guidance multiple years growth resume opening expert required multiple equivalent degree team start people growth
http,{T6Z8-G5NM66TJ-8374SMRQ},12/29/2010 13:44:07,SNK1280,PC-3271,http://lockheedmartin.com/WboUhagvat1636367808.htm,Job Hunting,strong customer develop required industry equivalent hours part-time equivalent management multitask technologies start contribute opening report passion starter visual develop customer starter industry benefits on-line self develop customer engineer guidance job salary sales team skills recruiter hours resume equivalent resume starter management report
http,{N7R1-H6PL74OA-8107GSQX},12/29/2010 14:30:46,SNK1280,PC-3271,http://jobhuntersbible.com/WboUhagvat1258877042.aspx,Job Hunting,expert salary resume contribute degree resume required equivalent skills multitask degree skills years expert multitask analyze responsibilities required contribute job on-time opening customer compensation passion team contribute expert develop customer skills relocation report management contribute job resume report management engineer develop interface starter starter technologies sales interface customer passion engineer required initiative technologies management customer engineer initiative salary on-time
email,{J9J1-Q9WA59CM-3640GEJY},12/29/2010 15:15:30,SNK1280,PC-3271,Mack-Tyrone@northropgrumman.com,,,Sarah.Natalie.Knox@dtaa.com,Send,17166,,Job Hunting,passion team salary sales people passion platform years experience hours responsibilities degree strong interface resume platform compensation part-time develop guidance industry required years relocation years opening resume people required platform on-line start resume degree resume start years required degree
http,{Y9P0-E5QQ84RM-7881KUYH},12/30/2010 10:46:33,SNK1280,PC-3271,http://lockheedmartin.com/WboUhagvat1636367808.htm,Job Hunting,sales people growth growth process people benefits growth people required report experience customer concepts experience dynamic experience skills multiple develop interface required required multiple on-line resume experience team multiple technologies management contribute technologies process team technologies years required job industry multitask industry call
http,{Y5K8-M3LV96UK-3615WQRG},12/30/2010 11:33:02,SNK1280,PC-3271,http://jobhuntersbible.com/WboUhagvat1258877042.aspx,Job Hunting,multiple team industry degree starter self skills start experience people growth interface opening management engineer guidance starter part-time interface develop starter responsibilities industry starter self dynamic passion analyze multitask platform resume technologies experience team skills industry degree on-time multiple responsibilities initiative experience platform team dynamic responsibilities interface years contribute
http,{X5L7-L6YS59EE-0918CLOZ},12/30/2010 15:37:07,SNK1280,PC-3271,http://lockheedmartin.com/WboUhagvat1636367808.htm,Job Hunting,on-line strong multiple equivalent interface growth responsibilities resume degree multitask technologies passion passion report self management dynamic technologies team develop experience develop contribute platform benefits visual people develop expert platform self years skills industry develop multitask required multitask resume experience industry people skills people passion resume experience responsibilities develop growth resume analyze interface customer technologies industry engineer concepts passion skills strong skills equivalent resume benefits contribute multitask
http,{P1E9-E8GQ29JF-8448NUOI},01/03/2011 10:20:10,SNK1280,PC-3271,http://lockheedmartin.com/WboUhagvat1636367808.htm,Job Hunting,relocation strong resume years report report strong initiative benefits experience resume benefits salary people platform strong start concepts dynamic starter multiple years permanent skills job resume initiative years platform start opening growth report degree relocation responsibilities strong permanent multitask people concepts people years experience initiative
http,{W5P1-J5ZF30IR-9570ZPTX},01/03/2011 11:01:42,SNK1280,PC-3271,http://lockheedmartin.com/WboUhagvat1636367808.htm,Job Hunting,experience on-time recruiter equivalent interface customer on-time opening equivalent multiple initiative experience equivalent guidance on-line degree platform experience years growth develop multitask permanent expert job benefits contribute recruiter skills start compensation strong multiple experience passion experience
http,{F0N8-W4EA17GP-1440DHGF},01/03/2011 12:40:41,SNK1280,PC-3271,http://linkedin.com/WboUhagvat1479839504.aspx,Job Hunting,responsibilities benefits passion starter required degree degree team on-time sales management guidance dynamic years start passion start sales start engineer industry sales start report multiple years years contribute skills initiative years expert equivalent multitask dynamic analyze multitask interface experience multiple analyze contribute management develop develop analyze benefits
http,{V3H1-B2TS46BQ-3841HXCD},01/03/2011 14:53:32,SNK1280,PC-3271,http://lockheedmartin.com/WboUhagvat1636367808.htm,Job Hunting,skills opening responsibilities develop experience opening platform job job guidance degree responsibilities expert opening years required resume interface responsibilities contribute required contribute experience resume customer self passion dynamic benefits degree equivalent customer guidance people required responsibilities platform growth permanent team technologies responsibilities experience initiative resume interface resume skills customer multiple growth benefits part-time report part-time degree skills passion multitask skills salary
http,{K5H2-W5FG72TK-0230UAHN},01/04/2011 09:54:07,SNK1280,PC-3271,http://lockheedmartin.com/WboUhagvat1636367808.htm,Job Hunting,responsibilities analyze industry degree starter team job equivalent required relocation management multiple on-time multiple team people concepts contribute interface equivalent resume analyze compensation strong resume visual degree process engineer resume multitask skills analyze job skills part-time management skills
http,{K0G1-D8JA12YU-5652JPLU},01/04/2011 10:09:50,SNK1280,PC-3271,http://monster.com/WboUhagvat1180707852.html,Job Hunting,technologies part-time degree guidance technologies contribute equivalent management starter platform management years growth on-time strong technologies compensation report sales degree industry sales dynamic passion report technologies management resume opening guidance customer report team passion experience multitask equivalent interface experience process experience self sales compensation dynamic job required
http,{R2I4-W9GE84KG-8946RVGV},01/04/2011 10:46:52,SNK1280,PC-3271,http://monster.com/WboUhagvat1180707852.html,Job Hunting,passion skills customer guidance report job experience hours platform passion required growth required people start team benefits process opening multitask process management experience opening process years strong resume growth on-time interface sales interface multitask industry sales people degree concepts start hours start salary sales equivalent team sales develop contribute interface resume sales platform management
http,{S2C2-J4VX57VB-7303YUNL},01/04/2011 12:17:07,SNK1280,PC-3271,http://monster.com/WboUhagvat1180707852.html,Job Hunting,customer start skills required permanent concepts dynamic skills people experience resume management starter job years experience years on-time management on-line visual expert contribute concepts develop team customer management platform dynamic strong opening customer people start required multitask people
http,{A4X5-Y6JK51MN-4230QDJX},01/04/2011 12:23:33,SNK1280,PC-3271,http://monster.com/WboUhagvat1180707852.html,Job Hunting,multitask years concepts resume management initiative growth initiative analyze degree multiple contribute on-time responsibilities concepts team degree years people people salary customer concepts engineer
http,{H7K4-R1WO12YZ-1119NWCV},01/04/2011 13:01:37,SNK1280,PC-3271,http://monster.com/WboUhagvat1180707852.html,Job Hunting,industry years job skills sales multitask equivalent multiple industry customer job initiative develop job resume guidance opening industry equivalent start resume interface permanent resume multiple experience degree on-time management report self responsibilities passion passion benefits on-time experience part-time years responsibilities benefits develop benefits skills compensation contribute on-time multiple concepts
http,{E8A9-Q6SR86RA-5151KHOT},01/04/2011 14:13:26,SNK1280,PC-3271,http://jobhuntersbible.com/WboUhagvat1258877042.aspx,Job Hunting,management people years report multiple contribute permanent develop opening experience degree salary opening self responsibilities process engineer years industry customer required experience report hours initiative years platform equivalent team industry people degree expert multiple process experience
http,{V3Z1-T6JN25BG-2022NWCS},01/04/2011 14:49:38,SNK1280,PC-3271,http://monster.com/WboUhagvat1180707852.html,Job Hunting,interface multiple develop customer industry dynamic benefits start start customer on-line on-time opening people process strong skills initiative strong customer skills people experience years industry technologies process equivalent responsibilities resume on-time multitask technologies benefits compensation develop management responsibilities required resume resume strong expert start benefits initiative expert degree passion required
http,{F7Y1-G9FQ90OE-3967FPPH},01/05/2011 08:07:27,SNK1280,PC-3271,http://lockheedmartin.com/WboUhagvat1636367808.htm,Job Hunting,develop customer self multitask multiple management strong growth compensation customer interface multitask multiple opening dynamic compensation growth growth contribute salary passion required on-line growth management multitask years team industry people
http,{D3E6-R8GK11TB-4851JSIL},01/05/2011 12:34:50,SNK1280,PC-3271,http://lockheedmartin.com/WboUhagvat1636367808.htm,Job Hunting,equivalent develop analyze people report resume recruiter job team sales required people contribute equivalent start years skills industry team years required start years multiple opening contribute customer part-time dynamic interface growth multiple develop process platform multiple management responsibilities sales technologies dynamic required industry job hours resume benefits platform experience experience
email,{Z7E8-P5BL66ID-5229UACE},01/05/2011 15:15:32,SNK1280,PC-3271,Mack-Tyrone@northropgrumman.com,,,Sarah.Natalie.Knox@dtaa.com,Send,56615,,Job Hunting,concepts skills customer sales years multiple experience salary people concepts experience job technologies job call industry management team growth starter multiple sales report opening multiple job resume hours platform responsibilities sales recruiter dynamic guidance recruiter opening develop self starter responsibilities start strong opening benefits recruiter management
email,{V8D4-L3AB82EO-7005LFYT},01/05/2011 15:46:25,SNK1280,PC-3271,Mack-Tyrone@northropgrumman.com,,,Sarah.Natalie.Knox@dtaa.com,Send,36320,,Job Hunting,sales passion people start experience strong on-line develop passion management experience dynamic platform concepts skills expert interface sales required benefits customer process experience analyze interface skills resume years develop process concepts multiple skills contribute strong years expert technologies passion people passion
http,{U5Y4-B5MO64PA-9122WRQS},01/06/2011 09:57:56,SNK1280,PC-3271,http://monster.com/WboUhagvat1180707852.html,Job Hunting,sales technologies part-time skills passion management on-time on-line technologies salary job benefits permanent skills customer job technologies platform responsibilities develop develop on-time customer technologies equivalent opening process passion starter industry
http,{H1Y3-K3BG26TH-4618MYAV},01/06/2011 11:42:43,SNK1280,PC-3271,http://monster.com/WboUhagvat1180707852.html,Job Hunting,visual multiple responsibilities sales opening required visual platform contribute equivalent contribute responsibilities degree management required multitask concepts sales guidance growth management on-time contribute start
http,{W7P2-I8JI35CZ-2891XVAX},01/06/2011 11:51:50,SNK1280,PC-3271,http://lockheedmartin.com/WboUhagvat1636367808.htm,Job Hunting,develop start concepts contribute multitask multitask resume concepts customer job develop expert salary passion team degree visual visual contribute skills dynamic multitask dynamic management job dynamic concepts years technologies guidance guidance permanent platform experience required resume team hours start guidance multiple equivalent sales job develop
email,{H4N8-G8YC61LP-8914FECM},01/06/2011 14:13:14,SNK1280,PC-3271,Mack-Tyrone@northropgrumman.com,,,Sarah.Natalie.Knox@dtaa.com,Send,28823,,Job Hunting,responsibilities permanent platform contribute develop concepts growth analyze industry on-time skills process expert hours experience multitask self compensation degree multitask equivalent resume years opening customer permanent develop develop required growth skills required growth develop multitask
http,{Z1E2-Q6NK13DZ-2958KMUU},01/06/2011 14:22:20,SNK1280,PC-3271,http://lockheedmartin.com/WboUhagvat1636367808.htm,Job Hunting,concepts report technologies years hours degree concepts multitask equivalent team growth report strong management process report develop sales permanent industry multiple customer team responsibilities degree years people process guidance process people required platform people initiative hours technologies degree develop contribute engineer resume
http,{V0J7-J3CI98BB-6769DHCJ},01/06/2011 15:40:54,SNK1280,PC-3271,http://simplyhired.com/WboUhagvat57469130.jsp,Job Hunting,degree part-time resume sales on-time industry equivalent contribute contribute interface equivalent skills contribute responsibilities management resume equivalent start job resume opening experience technologies dynamic team industry opening hours job skills benefits process years years initiative opening sales permanent required multitask responsibilities
http,{U7Q6-K2GA58VY-8516UMRM},01/06/2011 15:41:21,SNK1280,PC-3271,http://lockheedmartin.com/WboUhagvat1636367808.htm,Job Hunting,team multiple hours experience develop multiple passion years analyze dynamic part-time start platform required multitask people initiative resume responsibilities growth management people equivalent equivalent salary contribute process platform team passion report skills resume compensation concepts experience strong multitask interface start growth job customer sales skills multitask skills skills sales experience customer skills experience process management degree
http,{P3K7-P7HY07UD-8276APAA},01/07/2011 09:29:10,SNK1280,PC-3271,http://jobhuntersbible.com/WboUhagvat1258877042.aspx,Job Hunting,compensation technologies platform part-time visual engineer concepts degree salary guidance experience multitask team concepts dynamic self equivalent start years permanent years team management salary management technologies multiple report skills required degree platform initiative multiple required resume years people initiative equivalent dynamic permanent people multiple multiple industry team opening team multitask sales years
http,{A0F6-W7QS09XY-2923ULIM},01/07/2011 10:28:08,SNK1280,PC-3271,http://lockheedmartin.com/WboUhagvat1636367808.htm,Job Hunting,team interface benefits technologies interface management required resume salary equivalent resume contribute contribute people experience multiple sales degree start dynamic dynamic skills equivalent multiple multiple start benefits opening degree resume opening people interface start
http,{D5V2-P8NW48XD-9309YONG},01/07/2011 11:59:15,SNK1280,PC-3271,http://monster.com/WboUhagvat1180707852.html,Job Hunting,contribute team team equivalent team management initiative responsibilities skills part-time skills years opening passion multiple develop multitask passion platform contribute team guidance process team required required dynamic concepts equivalent report analyze job responsibilities develop start contribute process experience
http,{X3B7-L2KN26FD-9689KKKT},01/07/2011 13:00:36,SNK1280,PC-3271,http://jobhuntersbible.com/WboUhagvat1258877042.aspx,Job Hunting,required concepts concepts passion develop self dynamic self initiative equivalent resume skills experience years develop experience benefits people experience people people team years years on-time team part-time required report team experience people opening management years people interface technologies self skills opening compensation skills resume growth resume sales initiative
http,{H0S6-R4MT22OJ-1427QCPT},01/07/2011 13:03:09,SNK1280,PC-3271,http://lockheedmartin.com/WboUhagvat1636367808.htm,Job Hunting,platform compensation self industry team people analyze equivalent multitask experience contribute growth start sales customer strong report self guidance self management platform skills resume part-time part-time platform growth initiative resume industry permanent contribute concepts years experience interface experience permanent interface hours expert team customer required report sales customer on-line years start platform required multitask concepts resume initiative concepts skills develop call resume start contribute part-time
http,{D6L6-N3XE06OQ-4197NPCR},01/07/2011 15:00:24,SNK1280,PC-3271,http://linkedin.com/WboUhagvat1479839504.aspx,Job Hunting,platform skills permanent engineer strong salary customer concepts benefits concepts passion skills develop engineer growth growth compensation benefits technologies multitask team growth permanent years benefits industry contribute report
http,{B4M8-C4GU10TX-4374PGOQ},01/07/2011 15:21:24,SNK1280,PC-3271,http://simplyhired.com/WboUhagvat57469130.jsp,Job Hunting,people platform required industry initiative multitask growth industry degree industry strong experience report management skills multitask contribute benefits passion required analyze concepts customer expert people resume management customer equivalent expert expert interface strong on-time customer contribute process concepts years benefits experience responsibilities
http,{L4Y3-L4JJ68YS-7115JBEX},01/10/2011 08:50:05,SNK1280,PC-3271,http://jobhuntersbible.com/WboUhagvat1258877042.aspx,Job Hunting,guidance growth hours multitask job industry contribute hours develop dynamic experience permanent equivalent responsibilities management equivalent resume equivalent skills equivalent responsibilities customer experience industry resume report multitask compensation process concepts management job self on-time concepts interface concepts interface report report people process develop
http,{P9T5-U9TH91YC-2116WZZA},01/10/2011 14:10:07,SNK1280,PC-3271,http://monster.com/WboUhagvat1180707852.html,Job Hunting,benefits expert required opening resume initiative job benefits degree experience passion multitask growth growth experience opening management years responsibilities permanent required job people hours hours analyze passion industry management technologies platform interface experience equivalent compensation management contribute multiple multiple dynamic interface job passion on-line responsibilities contribute benefits required
http,{S0T7-V3AF99TS-0681OSIA},01/10/2011 14:32:24,SNK1280,PC-3271,http://lockheedmartin.com/WboUhagvat1636367808.htm,Job Hunting,platform recruiter concepts initiative growth required equivalent required skills required multitask guidance management management multiple customer people hours growth dynamic skills concepts opening multiple sales resume experience required opening analyze starter passion resume responsibilities call multiple engineer on-time permanent multiple permanent industry opening
http,{W4U3-E4OH67RU-7359MMEZ},01/10/2011 14:51:42,SNK1280,PC-3271,http://lockheedmartin.com/WboUhagvat1636367808.htm,Job Hunting,opening required initiative guidance multiple dynamic initiative benefits on-line equivalent team start dynamic sales contribute job responsibilities multiple develop team team people analyze platform expert platform years years management platform skills job degree responsibilities multitask initiative interface people compensation report start start concepts start degree customer hours opening job interface
http,{J5A8-G7WT57XR-4789IFSH},01/11/2011 09:46:58,SNK1280,PC-3271,http://lockheedmartin.com/WboUhagvat1636367808.htm,Job Hunting,relocation report resume initiative management job develop resume team required develop dynamic sales multiple strong experience passion process experience growth degree technologies management guidance resume degree analyze on-time technologies people resume permanent technologies experience technologies start multiple
http,{N2I0-K3TN91IS-3639DZOE},01/11/2011 11:05:48,SNK1280,PC-3271,http://monster.com/WboUhagvat1180707852.html,Job Hunting,technologies required equivalent start experience hours sales guidance industry job develop opening experience concepts concepts management required self dynamic equivalent multiple experience growth dynamic responsibilities resume contribute benefits report concepts responsibilities responsibilities sales compensation initiative skills develop opening develop salary resume people sales growth platform process growth experience management equivalent customer technologies
