http,{E0V6-N9TA87OL-0344TQSK},07/21/2010 09:49:48,SIS0042,PC-5430,http://lockheedmartin.com/WboUhagvat1636367808.htm,Job Hunting,strong required experience opening years permanent resume growth required multitask multitask people management degree guidance guidance growth strong multitask dynamic hours technologies compensation self team team equivalent opening interface benefits opening sales
email,{Z5O0-D3QN07RM-3556OELB},07/21/2010 09:59:12,SIS0042,PC-5430,Mcmillan_Regina@boeing.com,,,Shelby.Isabelle.Saunders@dtaa.com,Send,22050,,Job Hunting,hours on-time platform salary management responsibilities analyze technologies part-time develop people expert develop sales analyze resume platform multiple years multiple years start customer sales on-time concepts self job job job strong job recruiter multitask multitask years responsibilities multitask management on-time multitask years industry years management expert contribute years management management industry job degree report develop self team start
http,{U1J4-P5IC33LH-3171ICBE},07/21/2010 10:50:42,SIS0042,PC-5430,http://lockheedmartin.com/WboUhagvat1636367808.htm,Job Hunting,guidance team equivalent process responsibilities equivalent multiple initiative platform develop required multiple engineer opening technologies expert technologies degree degree hours experience responsibilities degree initiative degree customer contribute resume platform compensation call start job job resume degree on-time interface job benefits experience responsibilities people opening contribute skills process analyze multiple people develop responsibilities platform skills visual industry industry expert
http,{U0F6-L8AY13IL-3671RIST},07/21/2010 10:58:07,SIS0042,PC-5430,http://jobhuntersbible.com/WboUhagvat1258877042.aspx,Job Hunting,resume people sales degree concepts starter people degree growth responsibilities team skills management people management analyze multiple contribute degree required contribute resume develop expert job opening degree initiative required part-time multiple start people initiative skills experience contribute required passion industry required job resume responsibilities
http,{H3E2-X1GO97TD-1270UMKK},07/21/2010 14:32:43,SIS0042,PC-5430,http://monster.com/WboUhagvat1180707852.html,Job Hunting,required opening industry management degree customer equivalent dynamic years contribute hours years develop growth resume resume self starter concepts technologies multitask job sales skills multitask management interface dynamic on-line initiative compensation interface team expert contribute on-time
http,{Q7N0-J7UO65XP-3990MDKB},07/21/2010 15:08:06,SIS0042,PC-5430,http://monster.com/WboUhagvat1180707852.html,Job Hunting,multitask experience years starter guidance skills benefits experience benefits customer required permanent management opening degree required self team experience skills multitask years opening benefits responsibilities passion customer industry platform responsibilities resume opening industry opening self recruiter opening customer industry start industry multiple opening industry concepts benefits resume job management self team equivalent report
http,{D7D4-S5UI30KG-3427COWN},07/22/2010 09:18:36,SIS0042,PC-5430,http://linkedin.com/WboUhagvat1479839504.aspx,Job Hunting,platform experience strong hours initiative degree expert sales recruiter customer multitask degree experience benefits call customer compensation expert develop on-time start initiative responsibilities responsibilities job resume multitask responsibilities platform call part-time salary dynamic develop people years platform sales degree passion customer expert job multiple people team opening concepts initiative
http,{F3T5-W7RT94JA-4540AHWO},07/22/2010 11:22:23,SIS0042,PC-5430,http://monster.com/WboUhagvat1180707852.html,Job Hunting,platform job responsibilities team team management people dynamic on-time dynamic sales responsibilities experience multitask team resume sales call team skills report interface platform passion on-time people responsibilities equivalent guidance multitask on-time job experience technologies salary years required responsibilities part-time compensation platform interface expert multitask resume multitask permanent industry multitask responsibilities team develop experience multiple equivalent on-time skills experience customer analyze skills develop people
http,{T1W8-T2SJ44EZ-4826VWDT},07/22/2010 11:44:43,SIS0042,PC-5430,http://lockheedmartin.com/WboUhagvat1636367808.htm,Job Hunting,contribute team required multitask technologies multiple analyze years growth report benefits interface degree degree technologies degree responsibilities resume permanent passion report experience benefits interface experience opening job passion degree management multitask opening dynamic concepts skills concepts required passion growth start multiple experience resume start
http,{N5J3-J4FB13EW-7114BVLQ},07/22/2010 13:05:03,SIS0042,PC-5430,http://jobhuntersbible.com/WboUhagvat1258877042.aspx,Job Hunting,part-time industry dynamic contribute required growth contribute develop hours analyze degree experience sales benefits develop platform dynamic industry strong interface hours experience growth benefits report equivalent sales call experience responsibilities compensation multiple salary industry industry job self experience years sales compensation initiative contribute platform hours management analyze people part-time start opening management required equivalent growth
http,{N0D5-E2IT55TC-9298ZHXJ},07/22/2010 14:40:45,SIS0042,PC-5430,http://lockheedmartin.com/WboUhagvat1636367808.htm,Job Hunting,develop guidance customer management develop process on-time degree management job passion degree part-time on-line required industry industry customer skills resume engineer multiple years part-time interface guidance contribute relocation initiative years multitask passion required required dynamic growth team required required technologies job develop on-time process resume initiative dynamic required growth
http,{Y9A1-Y4QG07AM-9184KFXK},07/22/2010 15:32:25,SIS0042,PC-5430,http://lockheedmartin.com/WboUhagvat1636367808.htm,Job Hunting,resume management industry engineer compensation management required skills opening experience experience equivalent customer multiple develop management dynamic team team develop strong degree starter skills develop start dynamic responsibilities people growth multitask on-time experience contribute opening on-line skills concepts hours opening years on-time interface
http,{B7J7-L6IE41OR-5483FGZB},07/22/2010 16:21:34,SIS0042,PC-5430,http://jobhuntersbible.com/WboUhagvat1258877042.aspx,Job Hunting,responsibilities team develop interface multitask sales multitask dynamic multiple relocation expert responsibilities team job initiative expert strong strong report contribute multitask management passion growth contribute team initiative people job skills passion multiple analyze starter industry growth people
http,{Z8N3-W1IQ90UN-7134IEWT},07/23/2010 10:17:09,SIS0042,PC-5430,http://lockheedmartin.com/WboUhagvat1636367808.htm,Job Hunting,team on-time initiative report people responsibilities years dynamic experience job analyze resume industry contribute contribute contribute required expert industry contribute compensation technologies guidance dynamic skills opening growth dynamic years on-time passion responsibilities people compensation concepts required salary skills degree experience resume responsibilities initiative process required resume people team interface responsibilities contribute management team team start team
http,{M2P8-E8XR13TU-3980LAWA},07/23/2010 10:23:04,SIS0042,PC-5430,http://lockheedmartin.com/WboUhagvat1636367808.htm,Job Hunting,strong skills benefits passion start resume experience technologies process develop industry report start analyze growth equivalent initiative customer strong concepts resume analyze benefits analyze people start concepts benefits sales growth resume years
http,{R0G0-A3QL18VX-7632ZYJD},07/23/2010 12:26:23,SIS0042,PC-5430,http://simplyhired.com/WboUhagvat57469130.jsp,Job Hunting,passion start skills job passion engineer benefits starter equivalent concepts required permanent visual responsibilities growth contribute multiple part-time equivalent starter contribute self degree contribute benefits responsibilities industry customer permanent contribute concepts contribute years equivalent on-time concepts degree opening guidance
http,{N2M6-R0GC61QN-2976TPDX},07/23/2010 15:30:47,SIS0042,PC-5430,http://lockheedmartin.com/WboUhagvat1636367808.htm,Job Hunting,multiple required experience on-time strong resume strong engineer on-time interface team responsibilities equivalent initiative technologies benefits guidance multitask sales part-time interface management equivalent degree customer salary multitask process strong opening permanent resume required experience equivalent strong initiative
http,{J2E5-E8CJ26IR-4686OEOS},07/26/2010 13:35:31,SIS0042,PC-5430,http://simplyhired.com/WboUhagvat57469130.jsp,Job Hunting,dynamic start visual multitask experience team resume multitask multitask experience equivalent starter technologies resume compensation years concepts sales compensation passion growth expert multitask skills part-time multitask analyze passion skills contribute degree resume skills benefits degree contribute multitask sales contribute initiative skills dynamic permanent self platform skills team initiative on-time
http,{Y5F7-Q4LY06UU-9302CJUR},07/26/2010 14:39:40,SIS0042,PC-5430,http://linkedin.com/WboUhagvat1479839504.aspx,Job Hunting,develop strong start expert multiple growth resume resume analyze industry contribute report multiple experience hours strong sales report multitask technologies develop management passion equivalent technologies management initiative equivalent job people self years required permanent team sales experience platform technologies passion concepts develop experience visual customer
email,{M1N8-E8NU87AE-7149KLEB},07/27/2010 11:06:53,SIS0042,PC-5430,Mcmillan_Regina@boeing.com,,,Shelby.Isabelle.Saunders@dtaa.com,Send,33135,,Job Hunting,contribute resume experience benefits relocation initiative concepts salary contribute resume guidance report team customer multiple responsibilities multiple technologies initiative technologies analyze hours job growth years on-time team passion visual develop degree experience sales part-time responsibilities
http,{D4C3-F5GE03FL-3708ZEXB},07/27/2010 12:04:42,SIS0042,PC-5430,http://monster.com/WboUhagvat1180707852.html,Job Hunting,management required customer responsibilities opening expert customer management skills experience management responsibilities customer analyze team degree report permanent multitask degree start benefits concepts starter skills people concepts develop industry engineer years technologies interface resume team years contribute develop multiple multiple expert develop required concepts develop degree on-line resume resume
http,{H7X4-X9UG09ZE-9452DJKR},07/27/2010 12:21:36,SIS0042,PC-5430,http://monster.com/WboUhagvat1180707852.html,Job Hunting,concepts skills visual part-time job platform customer develop degree experience expert compensation required concepts visual skills platform guidance skills benefits guidance on-time experience expert concepts opening expert people initiative experience job multiple
email,{F6O2-A2TJ79XB-5940UJGU},07/27/2010 13:14:50,SIS0042,PC-5430,Mcmillan_Regina@boeing.com,,,Shelby.Isabelle.Saunders@dtaa.com,Send,17511,,Job Hunting,job job years contribute analyze dynamic sales compensation report on-time concepts team interface recruiter passion experience guidance people required responsibilities customer skills guidance years report dynamic people report on-time experience opening growth growth expert resume required management multiple technologies customer customer equivalent initiative required experience opening part-time management required required sales permanent interface relocation permanent contribute permanent skills concepts team years benefits skills people people opening industry technologies required industry team management
http,{P5A8-D5ZU61UE-1904CDNP},07/27/2010 16:03:00,SIS0042,PC-5430,http://lockheedmartin.com/WboUhagvat1636367808.htm,Job Hunting,dynamic team recruiter people required job dynamic required experience multiple team passion experience call self concepts starter equivalent guidance dynamic degree visual resume opening relocation required start team multitask growth resume job opening interface analyze strong part-time relocation multitask on-line dynamic resume strong
http,{E1E4-J6LA04IA-5135HUYZ},07/28/2010 09:20:40,SIS0042,PC-5430,http://northropgrumman.com/WboUhagvat572113271.aspx,Job Hunting,job equivalent people technologies opening job job multitask degree opening analyze passion required technologies opening permanent process years visual analyze degree skills start start customer multitask contribute starter platform compensation management start required resume on-time compensation concepts experience resume industry required guidance
http,{K5B4-A3MN81JR-3624BCXY},07/28/2010 09:37:03,SIS0042,PC-5430,http://simplyhired.com/WboUhagvat57469130.jsp,Job Hunting,expert responsibilities passion process experience customer report team strong interface equivalent develop industry hours people salary multiple team strong benefits multiple sales management guidance multiple report guidance growth growth required required benefits report experience concepts call experience equivalent skills opening permanent multitask permanent resume benefits skills multiple years benefits team required industry expert resume experience technologies
http,{O1Q3-P0QY99IX-4813EQHD},07/28/2010 10:31:02,SIS0042,PC-5430,http://lockheedmartin.com/WboUhagvat1636367808.htm,Job Hunting,opening dynamic customer equivalent call passion start equivalent required years develop management job on-line strong interface people on-line required customer experience report equivalent team equivalent technologies growth skills responsibilities people initiative multitask resume skills opening customer multitask
http,{L1D8-B8GV59ZU-1763BPME},07/28/2010 10:53:46,SIS0042,PC-5430,http://jobhuntersbible.com/WboUhagvat1258877042.aspx,Job Hunting,analyze starter benefits people management job experience report starter degree industry contribute on-time multiple responsibilities multiple required permanent passion report hours expert technologies multiple permanent experience customer guidance benefits customer equivalent multiple on-line develop years resume salary recruiter job
http,{A7J6-T1KE41ET-6360KFUR},07/28/2010 11:04:20,SIS0042,PC-5430,http://lockheedmartin.com/WboUhagvat1636367808.htm,Job Hunting,resume strong engineer sales salary salary benefits strong experience concepts sales initiative required starter years multitask skills interface contribute platform growth hours management starter equivalent skills industry sales concepts contribute sales on-time technologies initiative opening platform start responsibilities required required
http,{J9J5-E6PT54AY-2651ECMA},07/28/2010 13:00:06,SIS0042,PC-5430,http://lockheedmartin.com/WboUhagvat1636367808.htm,Job Hunting,permanent experience responsibilities guidance team on-time compensation starter develop degree contribute job on-time job dynamic develop customer guidance interface contribute resume on-line opening contribute permanent strong passion responsibilities years benefits management experience develop multitask opening start salary starter growth skills starter people equivalent required start dynamic degree on-time equivalent
http,{T5C6-T3HQ21MR-8712EKDS},07/28/2010 14:30:08,SIS0042,PC-5430,http://monster.com/WboUhagvat1180707852.html,Job Hunting,responsibilities resume resume initiative expert degree on-time degree platform management required initiative strong recruiter platform platform responsibilities customer experience on-time multiple contribute dynamic dynamic required experience compensation required engineer experience compensation equivalent team management equivalent opening benefits
http,{J1S5-W0ES73TT-1187GNLJ},07/28/2010 14:56:54,SIS0042,PC-5430,http://lockheedmartin.com/WboUhagvat1636367808.htm,Job Hunting,opening dynamic permanent multiple responsibilities dynamic multitask years self process growth job technologies industry process report required degree customer report people job contribute benefits management start opening guidance multiple on-time experience team job start contribute concepts responsibilities degree people responsibilities concepts industry start dynamic required responsibilities resume required job
http,{L2L0-K1SJ15RY-2946RLBN},07/28/2010 16:00:25,SIS0042,PC-5430,http://lockheedmartin.com/WboUhagvat1636367808.htm,Job Hunting,resume responsibilities develop self resume job degree resume start dynamic job salary required management required develop start experience self strong recruiter required permanent skills equivalent experience equivalent platform opening equivalent concepts interface skills degree analyze benefits compensation sales technologies benefits develop compensation contribute job visual people skills engineer required salary years opening resume initiative years develop customer start contribute
http,{W9L9-X2AW87GT-2697CUED},07/29/2010 09:16:16,SIS0042,PC-5430,http://lockheedmartin.com/WboUhagvat1636367808.htm,Job Hunting,start people passion benefits start expert part-time call responsibilities dynamic experience equivalent opening growth management management platform equivalent visual multitask responsibilities platform develop multiple management years initiative on-time required benefits skills multiple develop management contribute platform develop skills customer on-time passion equivalent years interface concepts dynamic people people process resume degree call resume
http,{K8Z1-S7JS79GY-2919EJXA},07/29/2010 11:20:15,SIS0042,PC-5430,http://lockheedmartin.com/WboUhagvat1636367808.htm,Job Hunting,job job skills expert required analyze guidance initiative on-time benefits self contribute resume growth develop equivalent industry compensation permanent skills permanent interface platform resume industry contribute customer part-time years equivalent on-time dynamic report contribute permanent team report multitask initiative multiple job multitask growth people job platform initiative multitask job
http,{N9C9-L2SO63YH-7925KBRH},07/29/2010 13:29:13,SIS0042,PC-5430,http://lockheedmartin.com/WboUhagvat1636367808.htm,Job Hunting,required required self interface initiative management skills team multitask management part-time opening passion hours initiative resume report team people years skills degree dynamic platform platform salary self engineer growth multitask hours multitask recruiter contribute skills years equivalent benefits
http,{Q1Q9-B2GT92PE-9956NIID},07/29/2010 13:33:29,SIS0042,PC-5430,http://monster.com/WboUhagvat1180707852.html,Job Hunting,job opening opening team skills expert customer multitask develop years on-line sales develop report permanent resume skills experience guidance opening process experience team analyze management sales engineer management team growth required expert experience on-time part-time experience dynamic customer resume people multiple customer dynamic job resume visual skills salary years interface engineer hours start resume growth multiple initiative contribute management
http,{R5G6-N9EI56BP-4667SFHW},07/30/2010 10:45:31,SIS0042,PC-5430,http://lockheedmartin.com/WboUhagvat1636367808.htm,Job Hunting,contribute experience degree passion industry team years dynamic interface strong platform responsibilities benefits equivalent skills required resume management interface dynamic team technologies opening equivalent report management benefits hours years multiple responsibilities guidance equivalent resume responsibilities experience resume customer
http,{D3H1-S3AA10CQ-0899ODHB},07/30/2010 11:42:23,SIS0042,PC-5430,http://jobhuntersbible.com/WboUhagvat1258877042.aspx,Job Hunting,years required platform concepts part-time passion equivalent required guidance interface growth start growth strong industry resume interface experience guidance equivalent resume start interface on-time engineer develop management responsibilities customer required concepts people on-time multitask analyze multitask passion responsibilities compensation team benefits benefits benefits contribute
http,{N7B9-L2UQ02LN-7866XVFQ},07/30/2010 14:50:11,SIS0042,PC-5430,http://yahoo.com/hotjobs/WboUhagvat752138490.php,Job Hunting,customer technologies part-time develop dynamic years customer team degree initiative responsibilities passion guidance resume customer years passion platform compensation industry management degree responsibilities resume industry dynamic salary start people initiative interface guidance start equivalent customer report contribute degree sales salary platform years equivalent degree platform
http,{C7M3-P1GR22HC-0883SLLT},07/30/2010 16:03:31,SIS0042,PC-5430,http://lockheedmartin.com/WboUhagvat1636367808.htm,Job Hunting,on-time dynamic required required people skills people years required process concepts on-time strong concepts skills responsibilities permanent engineer guidance required self passion multiple responsibilities degree required multitask process strong start initiative opening multitask analyze required years years customer skills resume start years process benefits people develop hours skills permanent strong multiple resume dynamic team dynamic guidance
http,{Q5Y7-L6DB25OV-7202ELHN},08/02/2010 09:36:16,SIS0042,PC-5430,http://monster.com/WboUhagvat1180707852.html,Job Hunting,resume resume dynamic starter dynamic experience experience process contribute multitask concepts people years equivalent resume resume opening management platform on-time initiative strong degree job years management expert interface industry multitask skills management opening resume interface multitask skills expert process multitask experience dynamic develop platform degree develop required guidance platform
http,{M7O8-G0LG96IJ-7248RTXW},08/02/2010 14:02:58,SIS0042,PC-5430,http://craigslist.org/WboUhagvat1105403916.aspx,Job Hunting,part-time recruiter expert management dynamic starter passion compensation hours benefits concepts multiple self concepts job process responsibilities initiative develop guidance opening resume concepts strong degree multitask benefits multiple multiple initiative resume start guidance degree skills relocation years start management analyze sales salary on-time skills develop responsibilities resume permanent team initiative benefits sales industry technologies permanent dynamic
http,{U7T4-L6BR41IH-2670BJWR},08/03/2010 10:46:53,SIS0042,PC-5430,http://jobhuntersbible.com/WboUhagvat1258877042.aspx,Job Hunting,dynamic degree degree visual management on-time relocation concepts customer job multitask experience multitask management dynamic resume on-line experience contribute process hours process required contribute equivalent responsibilities years analyze responsibilities concepts people initiative start analyze on-time responsibilities initiative interface develop responsibilities degree growth passion experience degree report
http,{J7K5-S9VH57PR-7688LVHJ},08/03/2010 13:32:43,SIS0042,PC-5430,http://linkedin.com/WboUhagvat1479839504.aspx,Job Hunting,multiple opening analyze guidance permanent benefits contribute concepts experience management people skills on-time multiple required develop customer starter industry years sales team analyze analyze passion concepts growth growth equivalent customer strong years sales process concepts strong multitask multiple concepts contribute visual multitask passion people relocation degree salary multiple job concepts experience report expert resume
http,{C0M0-F0DW85ID-9322CIHU},08/04/2010 10:40:39,SIS0042,PC-5430,http://lockheedmartin.com/WboUhagvat1636367808.htm,Job Hunting,part-time degree on-time interface experience concepts multiple equivalent on-line resume contribute skills on-time benefits opening on-line benefits opening multiple management opening hours permanent skills initiative contribute expert starter industry multitask benefits technologies responsibilities multiple opening starter people team
http,{S8K4-S8LV74DT-4119BRLE},08/04/2010 13:50:16,SIS0042,PC-5430,http://monster.com/WboUhagvat1180707852.html,Job Hunting,management passion required guidance contribute years start passion opening passion responsibilities equivalent degree expert resume guidance multitask opening guidance guidance growth starter responsibilities report interface platform years experience team starter initiative platform recruiter multiple concepts start process dynamic industry part-time benefits process team interface equivalent analyze growth management permanent permanent compensation industry job strong required multiple
http,{X2T8-R6GX67GT-8745CPPW},08/04/2010 16:24:11,SIS0042,PC-5430,http://careerbuilder.com/WboUhagvat660170997.htm,Job Hunting,growth years degree responsibilities people growth permanent initiative sales expert concepts compensation multiple technologies dynamic concepts growth job multiple passion on-time report job benefits starter industry job experience technologies opening expert contribute initiative team industry job start passion on-time responsibilities
