http,{Z5T4-J0FG53IW-0390MJST},07/06/2010 12:22:38,SIS0042,PC-5430,http://lockheedmartin.com/WboUhagvat1636367808.htm,Job Hunting,on-line multitask team starter degree industry interface analyze skills opening dynamic growth benefits sales develop multitask years dynamic management industry concepts years initiative passion platform guidance customer degree on-line platform resume concepts passion management analyze skills industry concepts permanent
http,{U9A7-M5LM96LR-0791TOOM},07/06/2010 13:06:44,SIS0042,PC-5430,http://lockheedmartin.com/WboUhagvat1636367808.htm,Job Hunting,responsibilities job strong passion interface self required permanent salary skills required industry equivalent report experience resume part-time multiple team part-time self engineer permanent industry self resume self resume engineer responsibilities develop experience degree experience passion self guidance equivalent part-time develop sales degree develop multitask multiple responsibilities
http,{N1E4-Y7CZ17WQ-5551UHHN},07/07/2010 08:36:28,SIS0042,PC-5430,http://yahoo.com/hotjobs/WboUhagvat752138490.php,Job Hunting,required on-time analyze passion start team required hours start initiative start benefits degree initiative passion growth sales technologies guidance team starter platform degree hours starter team years resume job equivalent dynamic interface experience multiple dynamic strong multitask visual develop develop on-time
http,{K2Q7-F9AV82FP-1122JDXN},07/07/2010 10:21:10,SIS0042,PC-5430,http://raytheon.com/WboUhagvat343187784.jsp,Job Hunting,opening management report starter experience management hours multitask permanent team customer years strong job platform self develop resume people part-time people contribute people on-time resume required start report required on-time industry job technologies team compensation equivalent salary experience opening dynamic concepts required management growth responsibilities multiple concepts expert people on-line passion required multitask analyze years strong technologies degree call multitask industry salary resume strong platform customer concepts industry team permanent
http,{D6I0-V5ZR39SZ-9642FIKX},07/07/2010 11:32:12,SIS0042,PC-5430,http://monster.com/WboUhagvat1180707852.html,Job Hunting,concepts opening multiple benefits experience permanent relocation required multitask analyze permanent degree benefits resume permanent required years industry opening equivalent on-time strong benefits dynamic experience technologies platform technologies experience hours expert start call skills growth management dynamic job required skills platform team resume passion starter multiple management opening multiple equivalent years visual
http,{Y2E0-C2VE32UJ-6415WDEY},07/07/2010 11:37:10,SIS0042,PC-5430,http://jobhuntersbible.com/WboUhagvat1258877042.aspx,Job Hunting,expert required develop responsibilities opening job sales analyze start degree people degree equivalent develop technologies interface contribute people sales years required develop recruiter experience growth equivalent industry equivalent customer responsibilities engineer guidance contribute sales industry required starter expert starter on-time multitask industry concepts process compensation benefits team management multiple customer skills required
http,{L8C9-J6HE31QK-3683IVPL},07/07/2010 13:13:08,SIS0042,PC-5430,http://lockheedmartin.com/WboUhagvat1636367808.htm,Job Hunting,team skills required start technologies required multiple responsibilities degree process on-time hours permanent interface initiative benefits job required resume degree passion management report industry strong management hours permanent analyze team team on-time analyze platform required skills experience team multiple skills on-time job guidance on-line report customer passion team job job initiative skills management skills dynamic years contribute opening passion on-line job process analyze salary team permanent guidance
http,{Y2G7-U0JV22XF-2079XMPQ},07/07/2010 14:50:03,SIS0042,PC-5430,http://jobhuntersbible.com/WboUhagvat1258877042.aspx,Job Hunting,growth team customer management initiative equivalent on-time platform starter team team hours responsibilities responsibilities report concepts analyze on-line responsibilities degree develop passion customer resume experience permanent job platform degree develop contribute call multitask benefits strong resume opening multitask call management platform management skills passion required skills
http,{S1F8-A1NS37PU-1144HDLS},07/07/2010 16:07:19,SIS0042,PC-5430,http://lockheedmartin.com/WboUhagvat1636367808.htm,Job Hunting,team skills passion responsibilities management customer team permanent part-time customer equivalent team experience job develop initiative contribute customer job process customer interface starter experience experience resume equivalent resume people degree resume strong resume industry opening start degree on-time analyze concepts interface multiple part-time technologies responsibilities interface equivalent degree resume resume start degree report multitask visual passion customer people contribute degree start
http,{F4V0-T0IB57OI-0940ZXDQ},07/08/2010 15:33:56,SIS0042,PC-5430,http://jobhuntersbible.com/WboUhagvat1258877042.aspx,Job Hunting,experience call permanent equivalent interface multitask growth industry team benefits multiple hours team opening visual guidance growth benefits sales industry years opening resume resume degree passion customer customer years resume degree concepts years self on-time job customer skills skills initiative passion process passion compensation responsibilities
http,{U4P8-O9LT36YE-9517SFDI},07/09/2010 10:44:31,SIS0042,PC-5430,http://jobhuntersbible.com/WboUhagvat1258877042.aspx,Job Hunting,skills skills engineer multitask concepts develop analyze dynamic industry years people sales people resume permanent degree multitask starter multiple dynamic people contribute people report team permanent management starter start relocation develop equivalent part-time customer analyze opening initiative responsibilities hours skills contribute opening years degree start resume
http,{W9M0-R3PJ41MM-5341SKWL},07/09/2010 12:24:14,SIS0042,PC-5430,http://yahoo.com/hotjobs/WboUhagvat752138490.php,Job Hunting,multitask sales experience self team visual part-time benefits report initiative experience develop starter team experience growth required on-time benefits initiative guidance multitask develop experience analyze opening experience required multitask skills required expert industry initiative multiple process industry platform salary
http,{N8U8-Q4IL96NC-4248MNWR},07/12/2010 10:15:09,SIS0042,PC-5430,http://lockheedmartin.com/WboUhagvat1636367808.htm,Job Hunting,experience required years job required degree years skills required develop degree develop initiative skills industry permanent required initiative passion management start multitask concepts sales salary management years years skills customer passion required develop sales degree experience industry required report interface equivalent degree strong dynamic responsibilities sales degree
email,{O4N7-K3GB40QQ-2050BNHO},07/12/2010 11:27:56,SIS0042,PC-5430,Mcmillan_Regina@boeing.com,,,Shelby.Isabelle.Saunders@dtaa.com,Send,30634,,Job Hunting,develop customer guidance sales starter experience experience team multitask multitask multitask hours equivalent dynamic people sales required start salary initiative report develop platform resume interface dynamic technologies start process growth customer concepts multiple process degree skills salary equivalent part-time skills required process responsibilities guidance concepts develop customer process report technologies on-line customer growth required
http,{R2Y7-F9HY60FO-4859JICU},07/12/2010 11:33:35,SIS0042,PC-5430,http://monster.com/WboUhagvat1180707852.html,Job Hunting,concepts skills customer resume strong required team years growth develop platform salary permanent experience interface opening management multiple concepts salary job concepts expert on-time develop report team experience relocation strong interface responsibilities start growth dynamic passion people contribute experience people required passion start dynamic sales part-time job required passion growth required team job responsibilities dynamic engineer industry strong responsibilities start people dynamic permanent multiple benefits multitask benefits strong strong opening contribute passion self technologies
http,{V4J5-O7JQ07XQ-0582CHFY},07/12/2010 13:28:51,SIS0042,PC-5430,http://yahoo.com/hotjobs/WboUhagvat752138490.php,Job Hunting,strong guidance interface analyze develop multiple develop on-line compensation expert interface technologies process sales years on-line technologies experience years experience degree visual dynamic develop growth recruiter self initiative part-time interface start opening on-time team degree sales industry required degree call guidance contribute multitask customer strong responsibilities starter team degree platform
http,{U4G6-O5SD67WF-6186GGWC},07/12/2010 15:22:42,SIS0042,PC-5430,http://simplyhired.com/WboUhagvat57469130.jsp,Job Hunting,sales multiple required multiple team multitask strong on-time years years equivalent analyze resume part-time technologies call multiple experience process interface growth start responsibilities experience expert develop develop interface growth equivalent compensation job passion passion contribute visual people dynamic platform report job resume salary develop technologies
email,{D8N9-P1EW53YB-4315MPOW},07/12/2010 15:48:26,SIS0042,PC-5430,Mcmillan_Regina@boeing.com,,,Shelby.Isabelle.Saunders@dtaa.com,Send,28972,,Job Hunting,management initiative expert job platform platform dynamic start initiative compensation industry experience years resume sales experience resume initiative process passion skills guidance starter multiple develop report team dynamic job expert report call degree required on-time dynamic expert years customer years concepts report job analyze permanent resume equivalent interface opening skills passion customer on-time multiple on-time team skills relocation strong sales
email,{C0T2-L5KM21HV-6627TUHU},07/12/2010 16:06:41,SIS0042,PC-5430,Mcmillan_Regina@boeing.com,,,Shelby.Isabelle.Saunders@dtaa.com,Send,27370,,Job Hunting,develop hours people responsibilities customer multitask platform platform growth customer analyze initiative team develop compensation job report management skills technologies customer on-line dynamic skills report resume resume platform experience report technologies contribute report process contribute contribute report multiple report required platform passion guidance responsibilities responsibilities industry technologies people multitask opening equivalent on-line platform people strong experience report starter passion start people customer
http,{V1H2-S9EG67OS-9356OERJ},07/13/2010 10:20:00,SIS0042,PC-5430,http://lockheedmartin.com/WboUhagvat1636367808.htm,Job Hunting,benefits recruiter people analyze multiple benefits customer strong responsibilities platform sales experience multitask opening interface equivalent permanent management equivalent recruiter multitask start starter required equivalent skills concepts platform multiple sales dynamic required
http,{S2R4-E8EC21EM-3084BVLR},07/13/2010 12:43:46,SIS0042,PC-5430,http://lockheedmartin.com/WboUhagvat1636367808.htm,Job Hunting,required required contribute responsibilities hours part-time industry degree guidance management hours equivalent opening start customer team contribute initiative resume self interface industry management permanent degree expert on-time salary dynamic resume responsibilities expert growth customer years interface guidance resume degree self equivalent multiple required people guidance benefits benefits initiative
http,{N0P0-Z5DJ31CR-6487LNZN},07/13/2010 12:47:15,SIS0042,PC-5430,http://jobhuntersbible.com/WboUhagvat1258877042.aspx,Job Hunting,experience strong platform management experience develop develop strong responsibilities technologies benefits interface people multiple multitask equivalent team starter salary dynamic concepts on-time job industry team interface skills responsibilities years management start concepts interface industry growth skills industry responsibilities responsibilities permanent technologies required job customer multiple passion years experience resume required customer interface years customer
http,{O6E8-Z8ZU09GF-7754GCWC},07/13/2010 14:27:29,SIS0042,PC-5430,http://linkedin.com/WboUhagvat1479839504.aspx,Job Hunting,benefits years concepts visual people people multitask resume multitask permanent opening required on-time degree management guidance salary required multiple opening management start analyze part-time interface strong analyze years growth required resume management multitask develop responsibilities responsibilities technologies years growth industry multiple
http,{I9B3-J2PL03GP-9801ZDMB},07/14/2010 10:21:46,SIS0042,PC-5430,http://lockheedmartin.com/WboUhagvat1636367808.htm,Job Hunting,multitask platform industry multitask equivalent self required develop permanent degree people required responsibilities concepts customer multitask expert permanent on-time salary job opening required growth degree passion opening sales initiative sales guidance degree salary sales interface multitask expert job resume develop degree sales team visual technologies process team platform opening visual opening industry on-line dynamic passion self multitask permanent multitask passion on-time
http,{C2V8-A1OV65WK-3510CJFO},07/14/2010 14:20:55,SIS0042,PC-5430,http://linkedin.com/WboUhagvat1479839504.aspx,Job Hunting,team platform team call multiple initiative concepts people platform degree opening team required team contribute contribute experience on-time growth start report concepts sales process required skills permanent concepts contribute skills dynamic salary job benefits degree initiative technologies degree sales experience team technologies multiple degree develop
http,{X5A9-P8GO46OF-4684GSYF},07/15/2010 13:24:29,SIS0042,PC-5430,http://raytheon.com/WboUhagvat343187784.jsp,Job Hunting,years platform contribute growth resume years sales growth required growth equivalent start on-line resume interface dynamic start years report expert team on-time years call required industry interface required benefits skills required hours call permanent management job degree skills hours multitask part-time dynamic concepts contribute growth industry
email,{G2O1-Z8GY86FR-2810NUSP},07/15/2010 14:32:17,SIS0042,PC-5430,Mcmillan_Regina@boeing.com,,,Shelby.Isabelle.Saunders@dtaa.com,Send,36261,,Job Hunting,develop multitask interface people concepts develop sales multiple initiative benefits develop concepts people interface sales concepts dynamic initiative interface technologies resume multitask opening contribute expert industry resume report sales technologies industry sales multiple benefits years develop contribute customer responsibilities skills platform contribute dynamic
http,{K2S4-L8RQ94JY-3592VONL},07/16/2010 09:19:44,SIS0042,PC-5430,http://lockheedmartin.com/WboUhagvat1636367808.htm,Job Hunting,required management on-time required multiple experience multitask required years resume team experience expert industry industry expert equivalent growth experience industry growth concepts required interface concepts required job management part-time experience growth technologies multiple multitask required multitask growth develop engineer permanent resume job required customer experience years initiative sales growth responsibilities skills interface permanent
http,{V4A8-V7EM07SM-0451MWNL},07/16/2010 10:29:46,SIS0042,PC-5430,http://lockheedmartin.com/WboUhagvat1636367808.htm,Job Hunting,required start self opening guidance interface sales industry develop degree compensation engineer opening experience sales equivalent platform resume experience concepts customer required process contribute start hours people people growth responsibilities resume responsibilities compensation sales on-time salary strong analyze interface contribute management skills analyze compensation experience dynamic industry expert experience compensation strong permanent benefits customer multiple responsibilities experience degree report permanent equivalent on-line responsibilities degree contribute
http,{T4L4-X3DI48OQ-8591FNAZ},07/16/2010 11:06:03,SIS0042,PC-5430,http://lockheedmartin.com/WboUhagvat1636367808.htm,Job Hunting,on-time part-time passion initiative people self management customer start contribute passion multitask opening skills opening technologies interface team interface start initiative required required multitask technologies customer platform initiative hours strong skills degree responsibilities multiple multiple strong degree develop team dynamic customer job experience contribute initiative team hours responsibilities call customer opening platform opening responsibilities years team equivalent dynamic people
http,{B9P6-P2HG79XN-5025ELJZ},07/16/2010 11:50:13,SIS0042,PC-5430,http://northropgrumman.com/WboUhagvat572113271.aspx,Job Hunting,sales skills report responsibilities self initiative self expert growth job strong management experience expert years experience hours passion growth strong required compensation skills opening opening develop resume compensation industry years guidance growth sales resume contribute start
http,{I1K4-J9ZG54RT-6043MJAC},07/16/2010 12:33:21,SIS0042,PC-5430,http://lockheedmartin.com/WboUhagvat1636367808.htm,Job Hunting,team visual industry initiative job technologies skills industry resume dynamic team process growth technologies skills start job skills call multitask initiative responsibilities growth compensation process technologies responsibilities strong required opening growth skills required sales concepts technologies expert passion team required report industry expert report customer team equivalent develop required engineer
http,{G1B1-R6PY69XA-0247IBUC},07/16/2010 12:35:17,SIS0042,PC-5430,http://lockheedmartin.com/WboUhagvat1636367808.htm,Job Hunting,management starter platform management responsibilities customer skills visual experience multitask relocation required required experience responsibilities years skills experience concepts customer experience multiple years resume resume benefits expert develop platform interface management expert people responsibilities contribute required part-time industry degree on-line concepts interface permanent growth growth passion experience analyze
http,{N6M7-R6GV30QW-1257VVPU},07/16/2010 14:17:35,SIS0042,PC-5430,http://jobhuntersbible.com/WboUhagvat1258877042.aspx,Job Hunting,experience interface degree start starter degree technologies hours passion strong develop multiple initiative years multiple experience responsibilities platform skills degree growth resume growth opening report job equivalent on-time industry industry industry interface strong responsibilities resume initiative process experience customer dynamic industry team initiative strong process hours opening skills part-time technologies
http,{N7L2-T6CN57KY-0587FTPV},07/19/2010 11:07:17,SIS0042,PC-5430,http://lockheedmartin.com/WboUhagvat1636367808.htm,Job Hunting,degree multiple multiple process multiple compensation hours equivalent growth contribute visual report team passion required report passion analyze initiative multiple multiple people responsibilities guidance on-time passion contribute contribute job sales concepts degree develop salary multiple people experience years
http,{I7H6-T4BR73OT-3765YHZC},07/19/2010 11:51:37,SIS0042,PC-5430,http://simplyhired.com/WboUhagvat57469130.jsp,Job Hunting,resume process degree growth passion process experience skills platform degree interface salary report on-time degree contribute team degree resume self start years report hours equivalent strong platform years benefits report required responsibilities resume
http,{H0E2-L0WC97CA-2031DEZK},07/19/2010 15:34:50,SIS0042,PC-5430,http://jobhuntersbible.com/WboUhagvat1258877042.aspx,Job Hunting,expert start degree strong opening team concepts customer skills develop salary self passion multitask interface develop develop initiative industry growth resume required job develop customer guidance resume responsibilities resume multitask customer sales develop skills equivalent experience on-time expert passion sales years resume years recruiter contribute team management multitask team responsibilities customer salary develop customer customer resume strong resume technologies
http,{U6V9-U2HP12XY-5855ZIUA},07/20/2010 08:58:43,SIS0042,PC-5430,http://yahoo.com/hotjobs/WboUhagvat752138490.php,Job Hunting,team self industry opening multitask degree sales process equivalent responsibilities team industry multiple benefits process process part-time guidance multitask interface strong benefits develop sales resume management platform resume contribute experience dynamic compensation multitask interface resume experience develop equivalent initiative benefits technologies multitask degree on-line on-time technologies multitask
http,{D3V5-O4XR12SO-9505HQNB},07/20/2010 10:31:05,SIS0042,PC-5430,http://linkedin.com/WboUhagvat1479839504.aspx,Job Hunting,skills multiple develop platform benefits resume initiative compensation interface on-time required technologies strong concepts sales skills engineer growth on-time degree experience required guidance guidance concepts industry process multitask contribute salary concepts dynamic required growth required required growth years skills job sales resume develop permanent sales
email,{G7Z7-T3GL27EY-1218AEGH},07/20/2010 11:06:23,SIS0042,PC-5430,Mcmillan_Regina@boeing.com,,,Shelby.Isabelle.Saunders@dtaa.com,Send,40927,,Job Hunting,develop multitask resume process resume responsibilities strong report management benefits management management benefits platform process starter process responsibilities management contribute multiple degree team concepts technologies develop part-time experience multitask management degree contribute on-time years resume years experience contribute on-time years initiative customer years permanent platform concepts process resume people technologies on-line expert job team required benefits strong
http,{O2Y5-I5AF47VD-2115VDND},07/20/2010 14:03:42,SIS0042,PC-5430,http://monster.com/WboUhagvat1180707852.html,Job Hunting,customer on-time customer expert growth multiple equivalent resume guidance customer compensation growth skills salary expert resume team skills develop concepts responsibilities interface opening on-time report skills concepts visual years self multitask growth engineer sales job responsibilities opening report multitask degree industry strong concepts team job experience equivalent analyze permanent develop resume on-line years permanent dynamic technologies management equivalent
http,{B6Y3-H4PP50FU-7670WZAC},07/20/2010 14:46:34,SIS0042,PC-5430,http://simplyhired.com/WboUhagvat57469130.jsp,Job Hunting,customer contribute develop experience equivalent people responsibilities team growth contribute contribute resume experience opening job skills multitask analyze expert team team start compensation responsibilities job growth resume job engineer multiple management job part-time customer management people passion compensation analyze expert platform concepts responsibilities management platform
email,{I1N8-I5OW67DN-1263XIYM},07/20/2010 16:19:44,SIS0042,PC-5430,Mcmillan_Regina@boeing.com,,,Shelby.Isabelle.Saunders@dtaa.com,Send,34520,,Job Hunting,growth call responsibilities benefits team people initiative report experience permanent resume on-time benefits initiative develop responsibilities multiple salary initiative industry interface resume equivalent compensation people required permanent degree strong management report management industry report required sales hours multitask salary equivalent customer responsibilities responsibilities concepts guidance growth customer responsibilities passion degree start experience develop
http,{Z1R8-Y1XI15AM-7117JLEF},07/21/2010 09:28:07,SIS0042,PC-5430,http://linkedin.com/WboUhagvat1479839504.aspx,Job Hunting,experience multitask contribute years concepts management compensation on-line years responsibilities passion interface management analyze resume degree degree technologies sales team sales resume expert opening job strong people expert customer part-time on-time on-line concepts interface strong analyze interface required degree multitask years customer dynamic interface report strong platform on-line management expert platform team expert multiple
http,{I0Q4-L6PD99BV-3477WIWV},07/21/2010 09:36:14,SIS0042,PC-5430,http://lockheedmartin.com/WboUhagvat1636367808.htm,Job Hunting,dynamic resume dynamic growth required resume passion management on-time sales years part-time call report people experience guidance people dynamic experience on-time industry strong people growth industry passion resume benefits hours customer experience growth multitask customer multiple management
http,{C2Z2-K8PB99AF-2415JNOZ},07/21/2010 09:41:41,SIS0042,PC-5430,http://lockheedmartin.com/WboUhagvat1636367808.htm,Job Hunting,industry initiative starter opening interface process dynamic benefits job benefits salary passion skills opening start multiple relocation required resume required passion dynamic resume resume process initiative experience develop people process starter concepts industry multitask passion resume benefits passion sales degree job growth opening platform job interface
