http,{V7J6-A9LC06QU-3093FOUE},08/05/2010 15:20:02,MDS0680,PC-9688,http://northropgrumman.com/WboUhagvat572113271.aspx,Job Hunting,permanent multitask technologies analyze customer report hours industry dynamic start people start recruiter customer salary years customer contribute multitask responsibilities interface concepts multitask experience multiple experience contribute sales report required required skills customer compensation passion benefits report concepts platform management
http,{J3F4-E4EM48AA-0985NCID},08/05/2010 15:24:21,MDS0680,PC-9688,http://linkedin.com/WboUhagvat1479839504.aspx,Job Hunting,job develop permanent growth team report growth degree skills develop concepts required engineer responsibilities start growth passion multitask relocation benefits concepts degree develop strong customer concepts benefits starter experience technologies concepts skills dynamic skills on-time years report passion initiative management concepts strong job experience technologies expert industry initiative dynamic passion required responsibilities interface responsibilities required sales resume skills
http,{T8D2-F7PC89RU-8387HACS},08/05/2010 16:01:52,MDS0680,PC-9688,http://monster.com/WboUhagvat1180707852.html,Job Hunting,multitask customer customer team degree job required multitask starter experience job platform growth on-time sales on-time industry job responsibilities multiple strong skills sales hours experience years growth strong management benefits multiple opening growth technologies resume degree engineer interface passion dynamic required passion responsibilities on-time multitask technologies hours resume passion experience growth responsibilities experience
http,{N7M2-G2MY09GV-9557KVHR},08/06/2010 09:01:28,MDS0680,PC-9688,http://monster.com/WboUhagvat1180707852.html,Job Hunting,multitask expert interface multitask years multiple responsibilities analyze experience job required start opening initiative customer initiative industry experience part-time benefits visual guidance multiple guidance multiple skills team strong expert develop platform part-time opening develop develop growth start contribute skills resume growth permanent degree customer start on-line multitask multiple management growth opening analyze skills people people
http,{H9P0-Z8VZ04LU-4259WIDR},08/06/2010 10:42:33,MDS0680,PC-9688,http://monster.com/WboUhagvat1180707852.html,Job Hunting,report start multitask on-time interface guidance multiple concepts recruiter resume years responsibilities hours strong resume initiative people job contribute experience management platform strong customer resume analyze concepts job dynamic
http,{J8C4-F5TO64XI-8883FTDU},08/06/2010 13:58:58,MDS0680,PC-9688,http://lockheedmartin.com/WboUhagvat1636367808.htm,Job Hunting,process strong recruiter growth industry multitask on-line start report equivalent concepts benefits report job interface growth interface management guidance skills concepts growth passion multitask multitask skills required interface multiple contribute multitask experience passion equivalent multitask
http,{F0I9-G0BJ58YI-6425YCZM},08/06/2010 14:33:49,MDS0680,PC-9688,http://jobhuntersbible.com/WboUhagvat1258877042.aspx,Job Hunting,self job management resume hours dynamic people strong industry initiative concepts skills benefits resume passion degree skills concepts experience management skills team sales passion customer years industry skills resume salary multitask expert initiative resume required required benefits experience develop experience experience years permanent passion concepts concepts salary equivalent report contribute degree guidance concepts team people initiative expert multitask team strong responsibilities start contribute dynamic interface start passion visual
http,{O8H7-Y1GS36IF-8562ILTY},08/06/2010 14:55:39,MDS0680,PC-9688,http://lockheedmartin.com/WboUhagvat1636367808.htm,Job Hunting,experience starter multiple benefits equivalent equivalent responsibilities benefits sales responsibilities technologies growth equivalent part-time contribute guidance sales responsibilities experience equivalent equivalent degree team hours job multiple experience people resume required growth responsibilities process skills on-time passion experience opening initiative passion contribute opening start part-time resume opening management team resume skills
http,{H9O8-Y2MU80YU-7624ASQR},08/06/2010 15:19:12,MDS0680,PC-9688,http://linkedin.com/WboUhagvat1479839504.aspx,Job Hunting,required team skills report salary multiple skills technologies opening develop required resume on-time experience platform develop multitask job benefits benefits permanent sales interface equivalent responsibilities technologies required customer required equivalent expert management management benefits
http,{Y3W8-A1OC36FN-3697SKLL},08/06/2010 15:21:35,MDS0680,PC-9688,http://monster.com/WboUhagvat1180707852.html,Job Hunting,growth skills strong people expert team contribute required team strong experience benefits strong industry start required skills compensation required guidance industry on-time concepts develop people responsibilities growth resume equivalent benefits initiative benefits benefits contribute opening report passion years multiple strong report start equivalent interface resume concepts sales years part-time on-time experience hours initiative multitask passion passion part-time contribute
email,{G4Q2-I2ZD72KJ-7796AIWN},08/09/2010 08:36:08,MDS0680,PC-9688,Jayme.R.Garza@boeing.com,,,Melodie.Denise.Sykes@dtaa.com,Send,21493,,Job Hunting,passion call interface experience years multiple guidance concepts report benefits opening required start degree job sales resume benefits sales responsibilities dynamic resume compensation customer start customer initiative responsibilities job contribute dynamic customer contribute strong resume platform benefits growth contribute responsibilities contribute multiple equivalent salary years
email,{L4B3-L5JB84JD-5045HPWO},08/09/2010 09:33:47,MDS0680,PC-9688,Jayme.R.Garza@boeing.com,,,Melodie.Denise.Sykes@dtaa.com,Send,20594,,Job Hunting,guidance passion initiative experience interface strong responsibilities equivalent contribute resume guidance self sales required responsibilities process initiative management team years management skills experience part-time customer passion concepts multiple required platform required customer platform experience guidance sales hours platform degree initiative multitask opening benefits equivalent develop required equivalent multiple initiative compensation develop visual initiative sales team dynamic develop contribute dynamic
http,{U3H7-X7AB14TP-3925NMHI},08/09/2010 09:45:35,MDS0680,PC-9688,http://monster.com/WboUhagvat1180707852.html,Job Hunting,on-time passion skills skills team part-time report industry part-time sales experience permanent equivalent multitask strong industry multiple people strong skills technologies develop on-time platform customer job benefits strong analyze required people equivalent required responsibilities experience customer multiple develop degree multiple benefits guidance contribute process compensation strong growth required initiative concepts people customer team industry growth multitask
http,{F1F8-S8QP99WP-4521YPOW},08/09/2010 11:26:43,MDS0680,PC-9688,http://lockheedmartin.com/WboUhagvat1636367808.htm,Job Hunting,process required resume develop analyze develop team skills experience salary platform develop guidance equivalent people required degree strong growth permanent job self responsibilities salary resume team customer management passion growth sales opening
http,{E2V7-F7UB72WY-4727OXSV},08/09/2010 13:28:22,MDS0680,PC-9688,http://jobhuntersbible.com/WboUhagvat1258877042.aspx,Job Hunting,opening years concepts required multiple call experience passion hours platform multitask analyze technologies industry starter responsibilities report multitask develop contribute years platform analyze multiple growth dynamic responsibilities
http,{S8U3-X8MT16BH-2712SRTI},08/09/2010 14:37:17,MDS0680,PC-9688,http://monster.com/WboUhagvat1180707852.html,Job Hunting,experience management on-time part-time sales years resume opening management required analyze team equivalent analyze concepts technologies dynamic on-time management guidance degree recruiter multiple multitask skills experience passion dynamic sales industry responsibilities technologies sales people skills experience growth technologies
http,{O3P1-A2DT91WO-2562LQYL},08/09/2010 15:35:39,MDS0680,PC-9688,http://lockheedmartin.com/WboUhagvat1636367808.htm,Job Hunting,start equivalent industry degree expert resume team salary people multiple years self compensation customer starter industry engineer customer strong team initiative process permanent responsibilities benefits multitask on-line job start dynamic expert relocation equivalent experience initiative passion years experience start contribute starter benefits multiple experience
http,{H6B8-N5JZ77IN-0419FZGF},08/09/2010 15:55:44,MDS0680,PC-9688,http://lockheedmartin.com/WboUhagvat1636367808.htm,Job Hunting,multiple industry dynamic skills job guidance salary people expert guidance team resume industry guidance analyze strong industry report required contribute interface on-line customer years expert on-line permanent growth start management multiple concepts benefits equivalent
http,{G5X4-O3IA38NY-8069NSCQ},08/10/2010 08:41:18,MDS0680,PC-9688,http://lockheedmartin.com/WboUhagvat1636367808.htm,Job Hunting,management job concepts on-line team start platform growth growth concepts contribute multiple permanent develop platform team relocation strong analyze responsibilities guidance growth multitask benefits strong guidance multiple job passion years required on-line sales multitask contribute job initiative experience start responsibilities self customer resume visual equivalent multiple degree develop engineer self years management customer on-line platform equivalent technologies salary
http,{L2B1-R3NF88WW-5142ZJWV},08/10/2010 09:11:13,MDS0680,PC-9688,http://lockheedmartin.com/WboUhagvat1636367808.htm,Job Hunting,sales opening team benefits resume guidance degree opening passion required sales start benefits management starter relocation resume years starter degree industry platform job resume expert visual strong technologies permanent opening engineer passion platform self required report years
http,{Y1S7-A2BI85AW-7843QCWG},08/10/2010 09:57:33,MDS0680,PC-9688,http://linkedin.com/WboUhagvat1479839504.aspx,Job Hunting,process resume equivalent opening benefits experience responsibilities team opening years resume technologies required technologies passion opening interface platform skills technologies report visual people start dynamic recruiter hours passion equivalent experience multitask starter multitask expert people industry customer initiative concepts industry required opening experience management skills customer start responsibilities required industry interface team start on-time job years experience industry customer
http,{V1I1-E4AE14XZ-0700DSXG},08/10/2010 10:50:10,MDS0680,PC-9688,http://monster.com/WboUhagvat1180707852.html,Job Hunting,multitask permanent analyze opening on-time contribute responsibilities expert multiple team years multitask contribute start strong people permanent hours on-line benefits customer permanent required team responsibilities salary report job self benefits expert opening skills multiple on-time equivalent report multitask process multitask years benefits platform analyze industry self multitask dynamic concepts years team resume relocation compensation recruiter platform skills management passion
http,{E9U5-C7YJ47EI-9420WXQT},08/10/2010 11:23:41,MDS0680,PC-9688,http://lockheedmartin.com/WboUhagvat1636367808.htm,Job Hunting,platform skills team job concepts years strong multiple strong customer strong growth job management management benefits hours people expert required customer passion management years degree years benefits people start people contribute opening guidance job benefits equivalent permanent platform guidance platform process technologies industry growth equivalent guidance job growth salary contribute management degree job responsibilities guidance platform
http,{Q3S9-I8QL98HX-0089GZBR},08/10/2010 12:22:23,MDS0680,PC-9688,http://craigslist.org/WboUhagvat1105403916.aspx,Job Hunting,required dynamic people permanent years technologies develop initiative passion permanent experience passion permanent initiative concepts people experience develop platform expert responsibilities equivalent technologies multitask concepts customer multitask sales job experience interface job degree degree analyze experience years responsibilities industry platform
http,{L0X4-W7DS66FK-1672GTLP},08/10/2010 12:27:32,MDS0680,PC-9688,http://jobhuntersbible.com/WboUhagvat1258877042.aspx,Job Hunting,develop opening multiple customer customer dynamic responsibilities industry opening sales team develop degree develop equivalent industry job sales management required initiative degree platform experience experience relocation interface industry team platform visual expert develop expert experience team concepts multitask required platform industry strong
http,{P3P4-F8SK58RF-8806OLSJ},08/10/2010 12:42:00,MDS0680,PC-9688,http://monster.com/WboUhagvat1180707852.html,Job Hunting,growth guidance job hours self guidance multiple equivalent strong industry on-line people dynamic self develop resume resume start self customer equivalent multitask contribute dynamic passion on-time multitask required concepts resume permanent dynamic years start team starter visual responsibilities multitask opening visual multitask sales sales
http,{N1H3-W1HO36RV-6916KPYA},08/10/2010 13:09:40,MDS0680,PC-9688,http://monster.com/WboUhagvat1180707852.html,Job Hunting,people expert interface skills start job resume sales growth resume degree skills benefits hours multiple customer on-time call job start industry on-time develop concepts develop contribute management people degree passion contribute equivalent sales equivalent customer equivalent years interface concepts expert skills salary platform hours
http,{R0H1-D0TH95GI-0014TOLY},08/10/2010 15:54:25,MDS0680,PC-9688,http://lockheedmartin.com/WboUhagvat1636367808.htm,Job Hunting,salary multitask multitask expert job multitask sales on-time benefits on-time dynamic on-time visual strong responsibilities relocation customer degree concepts industry on-time self contribute expert years report dynamic customer benefits degree industry resume management technologies resume contribute management start customer years resume salary platform contribute passion required equivalent guidance growth technologies people concepts management job
http,{A6W3-P5IW07TE-8422CXZK},08/11/2010 10:10:29,MDS0680,PC-9688,http://linkedin.com/WboUhagvat1479839504.aspx,Job Hunting,contribute sales part-time multiple team opening multitask experience management management permanent guidance platform analyze team compensation starter dynamic years contribute required responsibilities resume hours opening degree people concepts degree dynamic required contribute years growth hours
http,{O3M7-T1OD99SK-9104CBYS},08/11/2010 13:51:50,MDS0680,PC-9688,http://lockheedmartin.com/WboUhagvat1636367808.htm,Job Hunting,management part-time equivalent platform interface industry growth growth resume dynamic responsibilities analyze starter dynamic resume guidance strong interface responsibilities sales passion team process contribute contribute resume team required equivalent process opening initiative management platform growth required technologies years experience people concepts platform years salary responsibilities guidance
email,{Q2Q7-I7EM92HL-1286BXHA},08/11/2010 17:02:20,MDS0680,PC-9688,Jayme.R.Garza@boeing.com,,,Melodie.Denise.Sykes@dtaa.com,Send,45720,,Job Hunting,job growth process equivalent experience start industry equivalent compensation report multitask dynamic growth compensation multitask initiative resume growth multiple benefits contribute degree job visual management multiple resume required platform passion skills interface dynamic contribute equivalent team equivalent skills team degree benefits
http,{U1T6-J7FI87KO-9838RMQT},08/12/2010 08:20:45,MDS0680,PC-9688,http://careerbuilder.com/WboUhagvat660170997.htm,Job Hunting,customer benefits customer starter strong start degree benefits technologies passion management interface growth platform interface resume part-time initiative resume growth start people process responsibilities platform required sales multitask job experience team contribute dynamic contribute skills team management relocation compensation customer expert degree years degree management growth passion skills growth
http,{E4B7-U5XF44CL-9018RKAE},08/12/2010 12:31:46,MDS0680,PC-9688,http://lockheedmartin.com/WboUhagvat1636367808.htm,Job Hunting,passion strong required dynamic report strong start interface industry multiple contribute process passion management expert job experience resume strong on-time guidance experience management management starter job starter part-time start years passion job required guidance on-time technologies call salary resume responsibilities responsibilities resume hours team people people resume self skills compensation guidance guidance
http,{Y1B7-O9XS66BL-2587NODI},08/12/2010 12:39:25,MDS0680,PC-9688,http://lockheedmartin.com/WboUhagvat1636367808.htm,Job Hunting,report years interface customer multitask resume hours salary interface growth growth permanent team expert management starter team team growth interface hours people expert strong team report platform required on-time develop people job skills job customer
http,{T1X2-J5ZV08FF-9241IERI},08/12/2010 14:39:22,MDS0680,PC-9688,http://lockheedmartin.com/WboUhagvat1636367808.htm,Job Hunting,platform analyze contribute on-line people required management years dynamic expert management technologies industry management equivalent visual multitask self team report develop interface passion start required multiple platform benefits multiple initiative process degree platform responsibilities interface resume customer equivalent degree on-time multiple start experience equivalent analyze multitask guidance
http,{L3I2-C9BL89GE-8702FOCC},08/13/2010 08:32:44,MDS0680,PC-9688,http://monster.com/WboUhagvat1180707852.html,Job Hunting,guidance responsibilities management equivalent skills interface concepts expert equivalent concepts management passion responsibilities resume people starter degree multitask multiple job multitask strong compensation develop responsibilities years equivalent process permanent experience contribute growth multiple initiative relocation analyze platform dynamic technologies degree interface report years experience strong degree strong growth skills dynamic on-time years on-time
http,{U0X5-I0DT69CC-0998DVBP},08/13/2010 10:21:09,MDS0680,PC-9688,http://lockheedmartin.com/WboUhagvat1636367808.htm,Job Hunting,develop years process team starter platform degree job team start interface equivalent hours growth industry required sales strong equivalent degree degree contribute responsibilities starter multitask expert technologies start multitask starter concepts sales years
http,{C5Q0-R5WY05BR-0718VITN},08/13/2010 10:46:30,MDS0680,PC-9688,http://jobhuntersbible.com/WboUhagvat1258877042.aspx,Job Hunting,years team benefits report people platform expert people sales initiative required equivalent process skills sales develop equivalent experience strong multitask develop multiple job on-line starter degree customer job multitask multiple process equivalent process industry equivalent strong customer benefits engineer resume
http,{H9V3-F8DI56LI-7070EZYQ},08/13/2010 12:32:32,MDS0680,PC-9688,http://lockheedmartin.com/WboUhagvat1636367808.htm,Job Hunting,contribute benefits sales experience multitask customer multiple multiple required salary relocation degree experience concepts permanent starter salary resume technologies process industry growth hours starter process skills on-time benefits job technologies dynamic team technologies develop opening industry resume industry platform contribute concepts concepts growth responsibilities job team years equivalent experience call on-line passion technologies people multiple permanent multiple people initiative
http,{Z6A8-O5GX03BE-9099XZIV},08/13/2010 12:36:36,MDS0680,PC-9688,http://linkedin.com/WboUhagvat1479839504.aspx,Job Hunting,management job job opening multiple growth technologies experience skills interface on-time concepts process develop initiative required relocation passion team dynamic industry analyze team team passion degree opening customer team required process interface resume management concepts interface multitask responsibilities multitask
http,{T7V6-W0TK85AL-0093QZNJ},08/13/2010 14:23:32,MDS0680,PC-9688,http://lockheedmartin.com/WboUhagvat1636367808.htm,Job Hunting,team team management on-line analyze multitask years expert degree years equivalent industry responsibilities part-time customer experience years report visual contribute on-time years report compensation technologies expert permanent customer resume technologies visual management technologies dynamic responsibilities multitask dynamic platform
http,{X6S5-X1FK54AE-9472PVPA},08/13/2010 15:32:54,MDS0680,PC-9688,http://lockheedmartin.com/WboUhagvat1636367808.htm,Job Hunting,analyze relocation guidance visual growth contribute resume starter contribute people growth benefits sales multiple industry experience industry passion sales required responsibilities guidance compensation passion customer on-line team process interface concepts report equivalent degree experience job dynamic team expert opening customer technologies start platform on-time skills benefits job opening technologies skills years degree multitask passion equivalent recruiter growth dynamic job skills management technologies concepts customer team people years contribute
http,{R9T6-W9DX08OV-3692TEKJ},08/13/2010 15:44:11,MDS0680,PC-9688,http://linkedin.com/WboUhagvat1479839504.aspx,Job Hunting,customer industry concepts equivalent responsibilities relocation resume experience years benefits customer part-time initiative contribute self resume passion initiative required salary concepts skills degree platform initiative job start technologies on-time job responsibilities multitask concepts customer process sales develop interface starter growth equivalent platform self start process years years
http,{S9N4-I5ZW56VS-4944TZDG},08/13/2010 16:26:58,MDS0680,PC-9688,http://linkedin.com/WboUhagvat1479839504.aspx,Job Hunting,degree benefits salary degree technologies resume dynamic management degree develop responsibilities years required develop technologies equivalent guidance permanent technologies team resume part-time platform sales sales customer process skills on-time contribute equivalent multitask dynamic compensation resume team responsibilities growth benefits resume dynamic
http,{V3X8-Z3SE71FB-5332MSMU},08/16/2010 10:34:33,MDS0680,PC-9688,http://linkedin.com/WboUhagvat1479839504.aspx,Job Hunting,expert passion permanent call sales sales call experience required start part-time self responsibilities required report required growth resume required multitask part-time develop opening sales process process growth permanent opening process benefits passion permanent responsibilities analyze develop develop self required multitask benefits multiple
http,{P5V4-T6MK90FI-4605MPYH},08/16/2010 12:25:49,MDS0680,PC-9688,http://linkedin.com/WboUhagvat1479839504.aspx,Job Hunting,expert people initiative strong develop strong report visual contribute experience multiple multiple resume interface interface relocation multitask on-line years resume years customer process required multiple experience required required opening expert benefits management sales management salary dynamic opening analyze platform passion required expert management on-time compensation report concepts
http,{A7E7-C9MX36TT-5601UKWW},08/16/2010 12:32:25,MDS0680,PC-9688,http://yahoo.com/hotjobs/WboUhagvat752138490.php,Job Hunting,growth multitask multiple multitask skills customer skills recruiter multitask expert benefits guidance skills experience multitask visual strong years team years platform part-time multitask equivalent skills on-time years strong management multitask multitask skills strong resume initiative sales passion management platform multiple resume customer on-line report benefits years years permanent concepts strong
http,{T9S5-S0NO50JF-3065OTQO},08/16/2010 13:52:50,MDS0680,PC-9688,http://jobhuntersbible.com/WboUhagvat1258877042.aspx,Job Hunting,dynamic platform degree multitask sales responsibilities multiple experience skills required skills benefits responsibilities customer dynamic experience develop platform sales years permanent job required growth process relocation years develop years passion concepts develop team responsibilities skills responsibilities hours concepts management team years sales opening guidance dynamic dynamic
http,{H0D2-T1JL77DX-6689NEQU},08/16/2010 14:40:21,MDS0680,PC-9688,http://linkedin.com/WboUhagvat1479839504.aspx,Job Hunting,technologies customer industry contribute technologies visual contribute call opening sales starter years required responsibilities management responsibilities multitask degree multiple job degree job multiple team interface interface relocation management sales contribute sales growth interface sales opening skills resume hours passion customer contribute passion opening skills on-time resume technologies
