http,{K7M0-D9YL74KQ-8076DJYQ},12/14/2010 08:34:44,SNK1280,PC-3271,http://linkedin.com/WboUhagvat1479839504.aspx,Job Hunting,people skills management responsibilities guidance responsibilities visual expert compensation degree multiple guidance required responsibilities technologies job opening team multiple strong relocation team customer dynamic multitask experience required starter equivalent report multitask concepts visual growth team multiple concepts growth resume contribute experience multitask platform team benefits required platform job skills starter multitask self multiple job dynamic part-time people
http,{X0E1-F1ML75ZP-9315GXFB},12/14/2010 08:51:00,SNK1280,PC-3271,http://jobhuntersbible.com/WboUhagvat1258877042.aspx,Job Hunting,skills years customer concepts resume platform start report on-time industry skills skills skills passion interface skills resume equivalent required start visual report degree platform platform sales years analyze experience responsibilities responsibilities required sales skills expert skills part-time guidance technologies resume sales self team required growth concepts multitask expert multitask people job report initiative part-time platform skills on-time responsibilities
http,{C5W6-M5TT69TC-1433VZHR},12/14/2010 13:12:02,SNK1280,PC-3271,http://linkedin.com/WboUhagvat1479839504.aspx,Job Hunting,industry sales on-time permanent skills people skills required salary platform benefits contribute responsibilities concepts permanent growth interface concepts report responsibilities opening required initiative contribute multitask salary resume initiative develop experience industry contribute team compensation team dynamic starter multitask compensation resume technologies sales multitask management sales resume dynamic required required report visual opening multiple
http,{M3C2-N3YC25SE-0043PMOA},12/14/2010 15:16:43,SNK1280,PC-3271,http://lockheedmartin.com/WboUhagvat1636367808.htm,Job Hunting,permanent equivalent develop multitask skills platform expert multiple experience salary technologies initiative team expert permanent technologies self interface sales interface responsibilities initiative expert management growth process start people start technologies multiple expert required required
http,{R1J3-R2CC69GG-4288BBHA},12/15/2010 09:45:31,SNK1280,PC-3271,http://lockheedmartin.com/WboUhagvat1636367808.htm,Job Hunting,degree responsibilities customer guidance expert responsibilities industry interface years responsibilities on-time dynamic concepts interface develop responsibilities multiple benefits resume on-time job experience contribute resume passion salary permanent degree start resume analyze customer job industry passion equivalent technologies contribute job process team platform job industry permanent part-time technologies initiative concepts expert job sales strong
http,{J4D5-B5CD95DR-5237TEGZ},12/15/2010 12:10:41,SNK1280,PC-3271,http://lockheedmartin.com/WboUhagvat1636367808.htm,Job Hunting,multiple concepts concepts degree industry years concepts responsibilities team multiple sales job permanent degree people on-time multiple skills resume experience expert management part-time contribute develop growth experience required required equivalent multiple hours skills skills responsibilities technologies responsibilities guidance multiple strong start management required salary degree concepts
http,{R7Y7-A4QH44ZB-7561UYCF},12/16/2010 09:25:20,SNK1280,PC-3271,http://linkedin.com/WboUhagvat1479839504.aspx,Job Hunting,technologies report skills degree multiple guidance required expert expert develop job resume interface platform passion resume benefits required responsibilities years required customer team passion platform sales analyze guidance experience contribute interface degree passion platform responsibilities hours growth responsibilities multitask required technologies
http,{S5F2-K8WU14DC-2958AXDL},12/16/2010 14:18:10,SNK1280,PC-3271,http://monster.com/WboUhagvat1180707852.html,Job Hunting,develop dynamic initiative team degree strong strong experience experience resume permanent compensation skills management years report starter team interface resume call customer benefits people develop report people platform concepts develop required team industry degree customer industry industry passion multitask skills guidance equivalent starter dynamic required resume initiative strong job
http,{W4L4-T1VM19BR-8567RJXZ},12/17/2010 08:52:13,SNK1280,PC-3271,http://monster.com/WboUhagvat1180707852.html,Job Hunting,part-time expert expert management experience degree on-time multiple job report passion permanent skills benefits compensation initiative team team growth resume sales on-time salary guidance resume salary on-time self required passion required customer initiative contribute equivalent required
http,{G8T0-G9JH47ZF-7416IOOY},12/17/2010 12:56:51,SNK1280,PC-3271,http://lockheedmartin.com/WboUhagvat1636367808.htm,Job Hunting,people process develop platform equivalent resume equivalent team skills benefits guidance resume part-time management initiative dynamic team years team degree report degree on-time passion report concepts management starter skills multiple skills permanent compensation equivalent develop engineer multitask management part-time experience expert multitask required degree team required analyze platform interface multiple initiative
http,{L8Z4-N9TC70DS-4975KYMD},12/17/2010 15:30:14,SNK1280,PC-3271,http://lockheedmartin.com/WboUhagvat1636367808.htm,Job Hunting,dynamic equivalent resume job technologies opening guidance salary multiple develop opening develop guidance management resume strong self technologies strong report years on-time experience concepts technologies visual responsibilities dynamic dynamic
http,{I9L4-H4GT52DJ-6853TPPF},12/17/2010 15:40:56,SNK1280,PC-3271,http://monster.com/WboUhagvat1180707852.html,Job Hunting,visual experience technologies skills platform required engineer salary years process management start expert degree years resume required experience resume strong initiative management platform multitask passion multitask degree passion years resume initiative management management visual start responsibilities platform report platform resume
http,{Q7J0-I9JZ58KD-4136HLSD},12/20/2010 10:05:49,SNK1280,PC-3271,http://monster.com/WboUhagvat1180707852.html,Job Hunting,develop years sales guidance on-time engineer responsibilities required platform resume hours strong equivalent people resume management benefits strong multitask concepts industry people benefits multitask on-time customer management years benefits report resume experience salary experience platform develop resume sales people sales initiative multitask multitask resume dynamic skills dynamic job develop process part-time benefits responsibilities years expert job report initiative management strong strong responsibilities
http,{I8C0-B6MI63ZC-6034RBFS},12/20/2010 13:42:59,SNK1280,PC-3271,http://lockheedmartin.com/WboUhagvat1636367808.htm,Job Hunting,interface technologies part-time management resume skills concepts degree people process on-time resume multiple platform analyze multitask resume technologies passion resume skills customer interface team resume industry platform team responsibilities job platform years required dynamic permanent strong self concepts skills report
http,{P4L6-P6SQ20UL-8906HCSF},12/20/2010 14:28:30,SNK1280,PC-3271,http://lockheedmartin.com/WboUhagvat1636367808.htm,Job Hunting,report required people skills degree guidance strong equivalent initiative hours growth process contribute multitask required initiative report sales multiple recruiter required resume responsibilities start permanent multitask expert strong required report required equivalent people equivalent strong dynamic growth years customer required
http,{X9H3-G7FN09JU-8531NVWB},12/20/2010 14:34:56,SNK1280,PC-3271,http://lockheedmartin.com/WboUhagvat1636367808.htm,Job Hunting,multiple benefits expert experience industry team process recruiter guidance permanent required team develop skills dynamic years management people contribute opening resume start growth resume dynamic responsibilities platform sales skills resume strong recruiter customer experience management multitask
http,{I2B7-B1FG85ST-4312WLFM},12/20/2010 15:19:02,SNK1280,PC-3271,http://lockheedmartin.com/WboUhagvat1636367808.htm,Job Hunting,benefits degree benefits years industry on-time degree develop growth people responsibilities expert multitask management job team management passion years team report people industry sales on-time sales years benefits on-time people self industry resume customer management benefits customer hours initiative guidance multitask contribute technologies sales required required interface dynamic multiple report passion customer dynamic responsibilities part-time
http,{B2Z0-N2KG00IQ-8054ORXT},12/20/2010 15:36:59,SNK1280,PC-3271,http://lockheedmartin.com/WboUhagvat1636367808.htm,Job Hunting,required management skills report analyze expert hours permanent resume required multitask resume permanent multiple develop analyze platform initiative customer engineer required relocation technologies initiative
http,{Y6H2-R7JT48YF-2386BIXO},12/20/2010 15:40:35,SNK1280,PC-3271,http://jobhuntersbible.com/WboUhagvat1258877042.aspx,Job Hunting,interface develop initiative experience resume interface guidance develop growth required platform technologies dynamic multiple passion industry develop opening permanent experience customer guidance multiple skills salary responsibilities guidance skills report resume multiple experience people report initiative people multiple team experience compensation equivalent contribute develop multitask starter degree develop responsibilities degree hours multitask
http,{Q8L1-I1BB78ND-5319MZNM},12/20/2010 15:43:14,SNK1280,PC-3271,http://lockheedmartin.com/WboUhagvat1636367808.htm,Job Hunting,hours years responsibilities industry years job equivalent skills opening guidance experience engineer guidance job on-line job strong salary multitask report industry engineer multiple
email,{H3R6-D3VG12XB-4990UNKP},12/21/2010 08:46:35,SNK1280,PC-3271,Mack-Tyrone@northropgrumman.com,,,Sarah.Natalie.Knox@dtaa.com,Send,28306,,Job Hunting,people on-line contribute experience job multitask required multiple required start interface salary degree job strong interface platform required degree guidance resume technologies concepts years job compensation interface hours required responsibilities opening benefits passion experience initiative growth opening contribute sales technologies start technologies job call customer develop required strong recruiter platform growth technologies
email,{P8Q8-R1TG44KP-2661PXEF},12/21/2010 10:01:24,SNK1280,PC-3271,Mack-Tyrone@northropgrumman.com,,,Sarah.Natalie.Knox@dtaa.com,Send,43966,,Job Hunting,experience technologies starter expert interface multiple process guidance required contribute team multitask skills benefits passion dynamic experience multitask benefits responsibilities salary responsibilities permanent resume interface skills customer resume management benefits initiative initiative equivalent report passion multitask growth expert process skills platform on-line experience resume hours experience resume people degree years
email,{Z5M7-S3XK96RZ-7219YSTE},12/21/2010 10:21:46,SNK1280,PC-3271,Mack-Tyrone@northropgrumman.com,,,Sarah.Natalie.Knox@dtaa.com,Send,38507,,Job Hunting,job contribute develop required initiative degree resume job skills resume relocation platform people relocation job visual multiple job initiative benefits multitask permanent engineer salary report benefits job benefits guidance compensation visual required technologies dynamic multiple skills platform call team analyze technologies analyze growth
http,{K1N6-O5ZP17EK-9765CEAE},12/21/2010 11:04:40,SNK1280,PC-3271,http://monster.com/WboUhagvat1180707852.html,Job Hunting,resume analyze required required resume degree permanent multitask degree team customer customer customer passion process required develop resume skills on-line people contribute report start strong equivalent resume industry initiative analyze compensation growth equivalent passion industry strong
http,{Q8V4-S8WP88IV-3200TWKM},12/21/2010 11:58:17,SNK1280,PC-3271,http://lockheedmartin.com/WboUhagvat1636367808.htm,Job Hunting,technologies concepts on-time sales develop years years platform team on-line required technologies platform equivalent job customer customer job contribute interface opening platform interface growth required report guidance concepts degree report multitask resume report opening platform customer experience job benefits permanent multiple multitask visual responsibilities contribute years management customer responsibilities initiative contribute industry industry
http,{N2J5-U9JE67ML-9214ZYJD},12/21/2010 13:02:40,SNK1280,PC-3271,http://jobhuntersbible.com/WboUhagvat1258877042.aspx,Job Hunting,report customer multiple technologies part-time job years resume multiple growth team self required start equivalent report concepts opening years develop contribute experience skills starter industry team skills concepts multitask permanent passion process years contribute experience resume passion experience responsibilities experience years call growth platform industry skills compensation required management responsibilities people part-time analyze compensation contribute resume analyze degree required management degree
http,{L6G2-Z6DW49NW-9838BVCB},12/21/2010 13:56:53,SNK1280,PC-3271,http://yahoo.com/hotjobs/WboUhagvat752138490.php,Job Hunting,experience required responsibilities develop experience contribute management passion customer dynamic job concepts management degree passion report multiple self call years concepts technologies experience platform develop team experience opening multiple skills growth multiple strong people on-line skills multiple report multiple visual recruiter initiative multiple years team skills customer on-time
http,{A7O4-V5AX41QO-2412EFKF},12/22/2010 10:33:01,SNK1280,PC-3271,http://northropgrumman.com/WboUhagvat572113271.aspx,Job Hunting,on-time multitask multiple team experience degree strong technologies growth contribute starter technologies develop multitask hours technologies years report develop process resume passion multiple industry report responsibilities responsibilities skills responsibilities years skills benefits management equivalent job experience benefits growth platform interface responsibilities degree hours responsibilities resume skills contribute people people initiative on-line part-time contribute on-time years passion
http,{U9U9-C4YD58LX-0481HHTV},12/27/2010 09:05:22,SNK1280,PC-3271,http://linkedin.com/WboUhagvat1479839504.aspx,Job Hunting,responsibilities concepts multitask opening contribute contribute platform on-line skills experience customer customer degree management team opening guidance degree develop equivalent strong resume multitask strong growth initiative report platform team concepts strong required self equivalent develop customer degree concepts initiative strong visual strong equivalent passion opening compensation experience hours concepts contribute platform customer experience interface multitask on-time multiple skills opening passion
http,{M7V0-N9HQ17AO-1737SMIM},12/27/2010 09:05:33,SNK1280,PC-3271,http://monster.com/WboUhagvat1180707852.html,Job Hunting,engineer management industry equivalent engineer recruiter analyze customer opening multiple technologies resume multitask growth report platform contribute multitask initiative years expert industry management interface team report team interface self permanent job process industry opening report skills develop management years opening job multiple resume contribute experience concepts expert skills
http,{R8W3-L2OK89JO-0713FVUX},12/27/2010 09:13:02,SNK1280,PC-3271,http://raytheon.com/WboUhagvat343187784.jsp,Job Hunting,growth starter people contribute develop self experience passion growth required industry skills analyze passion platform degree concepts management job analyze skills dynamic platform industry years multiple concepts passion equivalent initiative responsibilities resume resume interface years management resume multiple team sales equivalent multitask analyze engineer
http,{X2I0-X3YS42GB-0824UROJ},12/27/2010 09:22:40,SNK1280,PC-3271,http://monster.com/WboUhagvat1180707852.html,Job Hunting,contribute contribute team job equivalent report dynamic management visual responsibilities technologies years multiple initiative part-time skills degree interface industry salary equivalent growth years permanent analyze resume start multitask process people management passion interface passion passion on-time years years resume strong process required job
http,{J1D9-J0JT98RF-1868TFPN},12/27/2010 11:41:33,SNK1280,PC-3271,http://linkedin.com/WboUhagvat1479839504.aspx,Job Hunting,contribute team responsibilities people on-time report benefits degree multitask job years call hours develop required opening required benefits equivalent develop on-time job job passion people team industry report concepts skills benefits compensation concepts degree job contribute degree platform resume multiple benefits required part-time compensation team sales opening required self initiative degree experience
http,{Y0A3-Z1IG28GI-2287TIGA},12/27/2010 12:10:01,SNK1280,PC-3271,http://monster.com/WboUhagvat1180707852.html,Job Hunting,job responsibilities responsibilities responsibilities hours self growth guidance technologies degree passion engineer degree management equivalent sales interface customer multiple experience degree multiple passion part-time job hours contribute interface team skills industry industry growth customer resume job engineer guidance degree skills job multitask industry platform years strong management multitask people develop permanent
http,{T3X0-M3LM58LR-5866HBNP},12/27/2010 12:18:00,SNK1280,PC-3271,http://simplyhired.com/WboUhagvat57469130.jsp,Job Hunting,industry concepts report develop platform team initiative interface required equivalent strong multiple equivalent develop years people guidance growth customer process multiple strong expert platform multitask develop starter passion multiple required report years permanent report years start expert multiple multitask degree skills required opening skills years technologies
http,{H8U9-Z8LD21FP-2034SWKJ},12/27/2010 13:10:23,SNK1280,PC-3271,http://northropgrumman.com/WboUhagvat572113271.aspx,Job Hunting,initiative on-line opening initiative on-time job industry job develop customer platform skills growth analyze years industry job develop customer part-time skills passion strong develop customer start benefits guidance passion experience analyze years sales develop people initiative technologies passion report hours sales analyze report equivalent process customer multiple strong start responsibilities
http,{K4K5-K5TL53JY-0603ITMN},12/27/2010 14:13:57,SNK1280,PC-3271,http://lockheedmartin.com/WboUhagvat1636367808.htm,Job Hunting,multitask process concepts strong management visual interface required process multiple multiple years starter technologies part-time report customer skills platform job technologies self sales required team multiple start experience develop years customer
email,{T2X0-J7XX74DI-5816UNEZ},12/27/2010 14:45:58,SNK1280,PC-3271,Mack-Tyrone@northropgrumman.com,,,Sarah.Natalie.Knox@dtaa.com,Send,37939,,Job Hunting,multiple customer experience degree management concepts industry years platform guidance relocation starter opening customer required start responsibilities resume platform develop on-line initiative passion relocation resume platform degree develop opening on-time concepts initiative years interface customer guidance experience team experience degree growth multitask dynamic team concepts sales equivalent on-line engineer concepts on-time equivalent multiple passion self starter multiple guidance initiative platform
email,{O7F7-D6FN22QZ-1749TEXO},12/27/2010 15:37:52,SNK1280,PC-3271,Mack-Tyrone@northropgrumman.com,,,Sarah.Natalie.Knox@dtaa.com,Send,34850,,Job Hunting,guidance years industry resume responsibilities report interface develop years opening strong concepts responsibilities salary multiple dynamic team platform opening expert degree permanent contribute contribute guidance start skills resume passion strong dynamic multitask interface experience expert interface industry required opening concepts industry strong resume required
http,{H4U5-X2WF51QJ-1073AEYZ},12/27/2010 15:41:21,SNK1280,PC-3271,http://lockheedmartin.com/WboUhagvat1636367808.htm,Job Hunting,develop initiative strong management resume management on-time required hours initiative management equivalent customer customer resume equivalent management required start multiple guidance equivalent job years resume skills resume technologies multitask technologies degree concepts initiative resume opening job responsibilities contribute sales
http,{A1H5-S8AG99TY-4680OIET},12/28/2010 08:12:06,SNK1280,PC-3271,http://lockheedmartin.com/WboUhagvat1636367808.htm,Job Hunting,interface contribute interface concepts platform dynamic part-time resume contribute growth job management experience resume visual team develop sales permanent skills growth customer management starter customer develop required management platform opening management management visual interface platform multiple on-time technologies equivalent team degree industry customer start growth contribute engineer job guidance responsibilities resume customer initiative analyze multitask management visual expert
http,{O7A5-P9GY54SF-3222TIBY},12/28/2010 09:27:31,SNK1280,PC-3271,http://lockheedmartin.com/WboUhagvat1636367808.htm,Job Hunting,interface hours customer contribute years years report analyze customer interface experience management start initiative growth years recruiter develop industry start experience passion years initiative multitask people self benefits job passion industry equivalent industry contribute team visual management resume required interface passion call skills people dynamic expert strong sales expert skills report expert guidance start skills sales dynamic on-line multiple years analyze degree dynamic
http,{O0T0-D8UH40RQ-0527JHBZ},12/28/2010 09:34:38,SNK1280,PC-3271,http://monster.com/WboUhagvat1180707852.html,Job Hunting,customer years initiative responsibilities management concepts resume visual on-line team multiple concepts team management skills opening process job permanent equivalent required team develop growth relocation equivalent experience guidance analyze team resume concepts multiple multiple on-line team resume visual benefits benefits resume team multitask concepts permanent team benefits passion
http,{X8K0-V0SC29JJ-9550SMFY},12/28/2010 09:42:51,SNK1280,PC-3271,http://lockheedmartin.com/WboUhagvat1636367808.htm,Job Hunting,self resume platform experience years equivalent management self guidance team start self report sales resume multitask visual self degree process initiative required dynamic opening responsibilities compensation on-time benefits multitask required sales dynamic concepts report concepts team skills passion compensation hours required years sales guidance years resume multiple
http,{B4W5-Q9ET15TF-7683PPPD},12/28/2010 09:43:22,SNK1280,PC-3271,http://lockheedmartin.com/WboUhagvat1636367808.htm,Job Hunting,years degree permanent start analyze customer self experience sales passion customer equivalent experience growth interface on-time strong experience resume people initiative analyze team develop multitask growth develop growth responsibilities concepts concepts industry customer industry growth equivalent strong multiple concepts interface experience job management benefits start team management degree team salary degree responsibilities
http,{L6J6-D1YP42II-2268WYQA},12/28/2010 10:28:18,SNK1280,PC-3271,http://aol.com/jobs/WboUhagvat1963819229.jsp,Job Hunting,guidance passion on-time develop management engineer on-line growth report resume job people team process on-time equivalent hours compensation opening concepts experience sales benefits start report resume technologies starter benefits degree platform concepts growth process start multitask team technologies degree strong years multiple sales required starter multitask develop concepts develop starter resume growth required passion dynamic team growth years platform industry contribute responsibilities growth analyze
http,{M6X7-X8FM59BX-7890BGWV},12/28/2010 11:16:45,SNK1280,PC-3271,http://monster.com/WboUhagvat1180707852.html,Job Hunting,initiative resume analyze skills management salary resume sales initiative multiple industry required guidance interface management contribute platform visual team equivalent strong required strong opening permanent self guidance benefits concepts develop starter required strong recruiter industry years responsibilities opening responsibilities passion experience strong
http,{Z0L0-C9ME99MX-6320SUBN},12/28/2010 11:33:28,SNK1280,PC-3271,http://monster.com/WboUhagvat1180707852.html,Job Hunting,process required dynamic management analyze concepts concepts on-time contribute relocation process multiple multiple team customer multitask customer contribute growth sales growth start initiative management multiple opening guidance platform required on-time develop experience customer initiative permanent interface multitask required equivalent contribute benefits part-time growth years industry people skills industry skills concepts responsibilities responsibilities contribute sales multitask customer degree experience multiple
