http,{V5J6-H8XN89GG-2523UGXR},07/20/2010 08:10:25,MDS0680,PC-9688,http://lockheedmartin.com/WboUhagvat1636367808.htm,Job Hunting,strong start concepts equivalent guidance multiple growth develop people salary team growth people on-time skills contribute opening resume benefits compensation platform contribute growth people guidance strong contribute skills skills strong experience permanent growth resume on-time experience job sales dynamic years multiple people dynamic concepts responsibilities growth
http,{R8B6-S3QV45PB-7146ALDS},07/20/2010 17:30:59,MDS0680,PC-9688,http://lockheedmartin.com/WboUhagvat1636367808.htm,Job Hunting,required job concepts starter sales permanent growth degree resume recruiter responsibilities passion benefits multitask required develop responsibilities required growth skills initiative management technologies customer multitask strong opening platform skills platform experience multiple skills platform responsibilities permanent strong dynamic passion sales skills job opening opening multiple contribute contribute concepts degree sales skills hours expert degree job years dynamic skills multiple
http,{J5L1-H4GL52VF-9570NNEF},07/21/2010 08:28:03,MDS0680,PC-9688,http://simplyhired.com/WboUhagvat57469130.jsp,Job Hunting,industry passion on-time management guidance guidance passion skills report people years opening resume resume experience strong years equivalent equivalent years years opening resume relocation multiple contribute interface team starter report customer analyze compensation initiative degree resume growth expert growth start multiple opening resume multiple skills guidance resume platform strong contribute skills experience years expert interface customer sales experience starter job responsibilities dynamic degree interface on-time equivalent management experience
http,{V3X3-D3IQ75FI-8955OPMI},07/21/2010 13:38:55,MDS0680,PC-9688,http://monster.com/WboUhagvat1180707852.html,Job Hunting,on-time skills process team develop skills multitask experience self develop required hours responsibilities required team team experience dynamic develop passion strong responsibilities multiple opening management develop people years opening years customer technologies growth experience skills people people report team self on-time permanent team equivalent years required customer required team expert opening team technologies contribute part-time develop
http,{J1M8-K9GF77MG-7422XDCX},07/21/2010 13:49:56,MDS0680,PC-9688,http://jobhuntersbible.com/WboUhagvat1258877042.aspx,Job Hunting,years hours responsibilities platform guidance skills growth skills develop sales strong multiple degree years on-line dynamic people hours growth strong strong skills degree benefits resume initiative develop interface required degree guidance resume multiple engineer multiple opening responsibilities opening
http,{X0C5-B4FR15ST-3790EBQJ},07/21/2010 13:56:27,MDS0680,PC-9688,http://lockheedmartin.com/WboUhagvat1636367808.htm,Job Hunting,experience benefits customer required technologies part-time degree interface guidance degree report required report required degree platform develop equivalent multitask responsibilities required interface multiple interface passion expert guidance develop responsibilities skills report analyze team contribute concepts skills technologies equivalent start job equivalent permanent industry required passion platform opening develop experience sales skills team team management skills degree report technologies years experience on-time initiative self growth
http,{W6F2-J9BI17QE-9024PCZS},07/22/2010 07:58:09,MDS0680,PC-9688,http://monster.com/WboUhagvat1180707852.html,Job Hunting,team part-time develop years starter experience skills concepts resume process analyze visual on-time concepts technologies degree growth opening part-time develop hours initiative on-line engineer start analyze customer multiple platform starter dynamic start experience skills sales report growth contribute opening engineer
http,{C3U3-T0XB90MZ-8600DIWJ},07/22/2010 12:39:52,MDS0680,PC-9688,http://lockheedmartin.com/WboUhagvat1636367808.htm,Job Hunting,opening permanent develop develop platform required technologies growth responsibilities required relocation relocation equivalent industry platform sales concepts growth experience responsibilities resume resume initiative team on-time years opening equivalent technologies years sales dynamic compensation degree develop platform sales strong on-time equivalent team multitask platform call permanent strong responsibilities responsibilities passion opening multiple part-time guidance
http,{A8K5-J1AJ97WU-8271VXUI},07/22/2010 12:47:27,MDS0680,PC-9688,http://careerbuilder.com/WboUhagvat660170997.htm,Job Hunting,multitask growth equivalent multiple multitask analyze technologies on-time management sales multiple job required dynamic passion job report analyze on-time interface passion opening industry resume job analyze opening benefits technologies passion on-time analyze dynamic guidance part-time resume opening industry contribute industry initiative customer analyze resume develop contribute multitask management required passion years customer process required contribute
http,{Y0L5-Z0CW12KW-2774QWDL},07/22/2010 14:08:38,MDS0680,PC-9688,http://monster.com/WboUhagvat1180707852.html,Job Hunting,report part-time degree starter skills equivalent process dynamic growth resume self strong initiative develop interface years experience management responsibilities contribute on-time years team contribute growth customer strong equivalent dynamic initiative opening multitask job industry years customer platform part-time concepts salary on-time opening required years report experience platform team degree multiple dynamic years years responsibilities part-time platform sales skills team initiative interface
http,{R3U5-U7YE96VP-9196ZOVH},07/22/2010 17:24:14,MDS0680,PC-9688,http://monster.com/WboUhagvat1180707852.html,Job Hunting,permanent on-time customer job initiative analyze on-time interface resume skills expert experience part-time job multiple platform platform skills responsibilities concepts start people platform sales years platform skills equivalent resume resume opening technologies self report develop develop multiple team management technologies customer visual part-time job industry degree people resume compensation passion customer team resume growth interface job visual initiative guidance on-time part-time concepts initiative
http,{J6C4-F4OL76ZV-8248EDDF},07/22/2010 17:24:56,MDS0680,PC-9688,http://monster.com/WboUhagvat1180707852.html,Job Hunting,multitask required contribute management report salary growth concepts growth job passion management equivalent on-time hours people degree dynamic degree concepts team required passion platform on-line sales initiative degree equivalent responsibilities concepts guidance responsibilities degree opening customer dynamic multiple contribute initiative develop start multiple guidance years resume platform develop passion equivalent multitask industry multiple compensation equivalent passion multiple management sales passion strong platform customer concepts degree multitask experience responsibilities process
http,{U6V1-T8LG72FY-7782GNRF},07/23/2010 09:33:23,MDS0680,PC-9688,http://lockheedmartin.com/WboUhagvat1636367808.htm,Job Hunting,benefits concepts platform dynamic opening years interface platform required hours industry process job job years analyze multitask required required customer growth skills industry opening technologies industry
http,{O2F3-X5DL15ZJ-2552SDMF},07/23/2010 09:51:06,MDS0680,PC-9688,http://jobhuntersbible.com/WboUhagvat1258877042.aspx,Job Hunting,equivalent management permanent multiple management expert guidance compensation hours job benefits sales industry contribute industry interface multitask sales required multitask technologies degree multiple benefits concepts equivalent guidance team experience start relocation people start experience management recruiter analyze team team job industry
http,{M1I4-X7SH61ZL-3008KSCL},07/23/2010 10:09:33,MDS0680,PC-9688,http://simplyhired.com/WboUhagvat57469130.jsp,Job Hunting,salary report skills job start visual degree experience degree degree skills years resume concepts multiple team sales process initiative multiple strong team skills required passion equivalent opening concepts contribute develop management expert degree concepts resume multitask on-time responsibilities guidance technologies compensation salary industry degree interface part-time relocation dynamic sales required develop guidance skills required concepts industry dynamic
http,{H9F5-I1FC12YR-6259VSLQ},07/23/2010 12:09:03,MDS0680,PC-9688,http://jobhuntersbible.com/WboUhagvat1258877042.aspx,Job Hunting,develop dynamic start initiative people strong concepts starter passion opening responsibilities on-time skills expert degree resume team management team experience multitask years responsibilities management develop salary degree start job experience sales engineer customer multitask opening experience customer permanent required years multitask benefits management degree benefits experience part-time dynamic benefits resume skills experience on-line resume customer responsibilities concepts hours process part-time degree interface hours job customer people responsibilities
http,{Q2E8-C8SK68TR-2298TXGF},07/23/2010 13:28:57,MDS0680,PC-9688,http://lockheedmartin.com/WboUhagvat1636367808.htm,Job Hunting,interface sales skills team degree strong hours initiative responsibilities compensation people initiative opening multiple contribute years strong dynamic analyze management required dynamic benefits multiple resume develop customer on-time technologies develop multiple responsibilities contribute guidance required passion permanent years job develop develop required concepts job
http,{B8K7-Y3SD73MO-5502FVIS},07/23/2010 15:01:34,MDS0680,PC-9688,http://yahoo.com/hotjobs/WboUhagvat752138490.php,Job Hunting,growth process contribute dynamic report contribute customer resume resume sales contribute visual multiple strong experience dynamic interface on-time report strong resume equivalent process opening multitask sales experience industry management sales equivalent required contribute platform skills develop resume develop people years platform dynamic opening job years responsibilities years
http,{I1Z1-H2HD19JX-0833GANA},07/23/2010 15:56:29,MDS0680,PC-9688,http://linkedin.com/WboUhagvat1479839504.aspx,Job Hunting,industry guidance develop multiple equivalent resume resume customer industry interface growth degree required skills sales multitask resume management degree people skills years multiple resume responsibilities job develop sales sales report required report people guidance visual visual skills multiple part-time required responsibilities dynamic experience guidance degree degree responsibilities responsibilities
http,{B9N2-U1AB66FO-9360YKRH},07/23/2010 16:15:54,MDS0680,PC-9688,http://monster.com/WboUhagvat1180707852.html,Job Hunting,starter multitask contribute job growth platform required years equivalent degree benefits years analyze technologies required multiple experience people sales required develop starter multitask develop responsibilities growth dynamic relocation degree industry starter concepts on-line sales management opening degree responsibilities team relocation technologies equivalent benefits interface industry part-time dynamic multiple hours on-line multitask degree multitask experience start years interface analyze experience resume people
http,{N7Q3-H3EI52PC-9004IAQP},07/26/2010 09:24:59,MDS0680,PC-9688,http://lockheedmartin.com/WboUhagvat1636367808.htm,Job Hunting,contribute analyze on-time sales process part-time job customer platform experience start contribute platform responsibilities job dynamic contribute self resume starter interface customer guidance job compensation equivalent platform multiple benefits years permanent
http,{X6R5-N8HB08XS-8816GJIK},07/26/2010 10:51:27,MDS0680,PC-9688,http://lockheedmartin.com/WboUhagvat1636367808.htm,Job Hunting,degree start opening experience self contribute expert part-time multitask on-time industry engineer job skills initiative experience responsibilities passion dynamic engineer guidance sales management benefits contribute experience people contribute years platform platform industry benefits analyze initiative on-line industry develop permanent industry sales opening required
http,{C9Y8-P0HB45MK-4038YSSK},07/26/2010 13:05:15,MDS0680,PC-9688,http://monster.com/WboUhagvat1180707852.html,Job Hunting,hours on-time contribute skills growth multitask opening on-time years job resume experience years multitask customer experience resume starter team equivalent benefits multitask experience responsibilities multiple contribute report interface technologies self degree growth growth expert customer start concepts experience job contribute starter degree equivalent skills benefits
http,{G3X5-P3KF40ZL-6665TMHZ},07/26/2010 13:12:15,MDS0680,PC-9688,http://yahoo.com/hotjobs/WboUhagvat752138490.php,Job Hunting,job sales required process contribute required years growth on-time experience equivalent initiative passion start experience opening compensation develop equivalent multitask benefits part-time years skills opening contribute years
http,{S1N7-K0HU44DU-8287USRN},07/26/2010 15:20:55,MDS0680,PC-9688,http://simplyhired.com/WboUhagvat57469130.jsp,Job Hunting,skills self concepts permanent process interface multitask experience skills concepts team multitask equivalent technologies multitask part-time required passion skills on-time platform degree expert multiple responsibilities hours equivalent industry develop customer years concepts growth customer platform team hours equivalent years required strong resume develop multitask job permanent years required industry resume start develop resume salary resume
http,{Y3A3-S7UG82VX-9765QXWG},07/26/2010 16:58:51,MDS0680,PC-9688,http://jobhuntersbible.com/WboUhagvat1258877042.aspx,Job Hunting,opening contribute required responsibilities responsibilities multiple required required platform opening technologies benefits customer contribute responsibilities guidance on-time benefits people industry resume equivalent equivalent on-time concepts concepts platform benefits required report visual contribute start multitask report growth customer management experience resume initiative sales contribute platform opening guidance multiple technologies develop experience skills skills job sales on-line salary multiple equivalent job
http,{B7E5-G8AM74CJ-9371HBIK},07/27/2010 07:58:58,MDS0680,PC-9688,http://jobhuntersbible.com/WboUhagvat1258877042.aspx,Job Hunting,required people contribute industry contribute degree growth guidance experience people skills guidance report sales years skills management job start industry concepts engineer start required skills dynamic self opening required part-time multiple benefits sales benefits starter growth initiative industry skills team resume job team technologies on-time equivalent start dynamic report dynamic technologies skills
http,{J3V3-I4TN97HH-9700YDDB},07/27/2010 08:58:42,MDS0680,PC-9688,http://monster.com/WboUhagvat1180707852.html,Job Hunting,skills team initiative develop multitask skills compensation growth responsibilities benefits multiple benefits expert technologies management industry required technologies strong guidance years call benefits interface benefits analyze benefits customer job expert growth growth equivalent people guidance team multiple people industry years expert sales dynamic compensation job team experience degree multiple initiative start dynamic growth resume required visual required customer concepts sales required required growth resume
http,{C6F0-B1HY75PF-0741RWEI},07/27/2010 09:08:05,MDS0680,PC-9688,http://monster.com/WboUhagvat1180707852.html,Job Hunting,experience analyze skills multiple team resume report years interface contribute job growth growth strong concepts analyze technologies expert degree skills growth experience job skills self report skills expert develop multitask initiative degree concepts concepts report years multitask benefits responsibilities resume equivalent sales responsibilities years degree job develop expert job responsibilities
http,{E0K7-A4EN32PV-3206BIJI},07/27/2010 09:25:58,MDS0680,PC-9688,http://linkedin.com/WboUhagvat1479839504.aspx,Job Hunting,sales strong multiple growth skills concepts job team resume multiple resume develop recruiter management opening expert report required customer platform team years job customer degree salary equivalent years experience responsibilities start people technologies opening management platform experience growth growth growth report technologies resume equivalent opening call required initiative team growth years concepts required initiative passion develop job opening sales degree hours develop contribute required develop responsibilities degree growth self passion growth initiative contribute equivalent platform growth industry analyze start report platform strong compensation
http,{K3A1-L6MP79YW-5337KLFY},07/27/2010 09:55:42,MDS0680,PC-9688,http://monster.com/WboUhagvat1180707852.html,Job Hunting,start growth multiple opening concepts resume experience required skills management multitask job multiple benefits dynamic platform responsibilities people resume job degree management compensation people industry dynamic guidance engineer equivalent customer team expert multitask report resume experience concepts starter skills industry years start analyze dynamic management management passion on-time equivalent platform dynamic multitask people multiple multiple relocation required
http,{X5I0-Y8DH97ZR-4882OXKF},07/27/2010 10:48:33,MDS0680,PC-9688,http://jobhuntersbible.com/WboUhagvat1258877042.aspx,Job Hunting,dynamic strong hours responsibilities customer benefits on-time strong skills call required report interface guidance job strong management dynamic management degree initiative guidance equivalent skills required passion relocation experience engineer on-time resume concepts dynamic management part-time part-time hours strong degree passion interface on-time industry relocation opening multitask team experience job sales report people multitask passion job required expert interface people multitask degree develop permanent years develop opening required
http,{S4I6-N9FX43TU-9335AEZI},07/27/2010 11:08:47,MDS0680,PC-9688,http://yahoo.com/hotjobs/WboUhagvat752138490.php,Job Hunting,required required guidance multiple people multitask responsibilities interface concepts initiative benefits hours management industry develop team people start compensation responsibilities passion resume team skills salary concepts start management job starter team sales on-time degree contribute process process responsibilities process permanent sales customer guidance multiple sales customer people sales required visual contribute dynamic multiple experience growth management analyze
email,{U6L1-D4OJ77RF-0776YHGC},07/27/2010 11:52:42,MDS0680,PC-9688,Jayme.R.Garza@boeing.com,,,Melodie.Denise.Sykes@dtaa.com,Send,30857,,Job Hunting,years sales expert responsibilities relocation job resume expert expert concepts skills resume team hours years degree equivalent required on-time degree multiple resume skills degree industry resume recruiter dynamic on-line industry initiative responsibilities equivalent sales resume customer growth experience job degree technologies start interface team multitask growth equivalent strong expert contribute team salary on-time equivalent salary report management platform
http,{L7W5-S2FM43WJ-6112HCQB},07/27/2010 13:36:34,MDS0680,PC-9688,http://monster.com/WboUhagvat1180707852.html,Job Hunting,skills sales responsibilities industry guidance skills start start sales strong recruiter team customer guidance experience concepts part-time required opening initiative concepts required responsibilities platform responsibilities skills job self skills visual initiative develop initiative starter degree on-line growth required strong required expert analyze people industry visual concepts degree
http,{S9X9-K3VA65AB-4586ARCR},07/27/2010 15:13:05,MDS0680,PC-9688,http://linkedin.com/WboUhagvat1479839504.aspx,Job Hunting,growth job skills hours concepts develop team management required people sales process strong growth growth job customer required responsibilities multitask technologies salary degree customer technologies job permanent responsibilities industry growth job engineer equivalent management benefits opening process hours industry interface guidance permanent skills on-line industry skills contribute develop on-time multiple degree resume sales degree team team multitask industry growth
http,{F7U7-R0FQ15DS-3378XGGE},07/27/2010 16:26:13,MDS0680,PC-9688,http://lockheedmartin.com/WboUhagvat1636367808.htm,Job Hunting,strong visual industry multiple multiple sales required passion contribute report platform initiative job customer skills team interface degree job expert relocation team develop start experience initiative multitask responsibilities multiple on-time develop on-time skills growth guidance dynamic develop multitask opening experience start permanent years team interface people equivalent
email,{P4E2-L5LM53AG-1323PCSG},07/27/2010 16:41:54,MDS0680,PC-9688,Jayme.R.Garza@boeing.com,,,Melodie.Denise.Sykes@dtaa.com,Send,28417,,Job Hunting,on-time compensation benefits guidance start technologies dynamic opening dynamic skills growth job industry equivalent multitask interface contribute required guidance concepts recruiter required management people required resume required skills engineer on-line job analyze industry skills process resume management technologies analyze multiple passion on-time multitask experience concepts process required develop
http,{B3Y4-W1TI12DU-5505IXME},07/28/2010 08:52:47,MDS0680,PC-9688,http://lockheedmartin.com/WboUhagvat1636367808.htm,Job Hunting,required guidance experience degree degree compensation benefits dynamic guidance sales part-time equivalent passion concepts contribute required responsibilities management contribute skills strong starter resume platform strong opening degree start growth call years passion opening concepts multiple sales people contribute permanent multiple responsibilities relocation dynamic technologies on-line strong initiative
http,{W7C9-X1KF07RO-0314RQRZ},07/28/2010 09:50:02,MDS0680,PC-9688,http://monster.com/WboUhagvat1180707852.html,Job Hunting,report required develop team experience degree growth concepts resume guidance starter relocation concepts team part-time required experience sales opening multitask concepts resume interface platform part-time people platform skills sales compensation opening industry multiple industry required platform report permanent concepts contribute management job degree initiative develop strong team report concepts growth years analyze multitask team experience contribute call guidance
http,{M7Q7-I7OX90OA-0140JHPB},07/28/2010 12:10:48,MDS0680,PC-9688,http://monster.com/WboUhagvat1180707852.html,Job Hunting,team customer required interface team resume skills technologies customer report permanent salary engineer platform opening customer sales contribute opening people on-time customer degree dynamic experience platform customer initiative salary management on-line required salary strong skills growth benefits growth process contribute guidance resume salary compensation experience initiative degree strong develop part-time
http,{H4I2-A0NF14WQ-3260VWDB},07/28/2010 12:18:14,MDS0680,PC-9688,http://linkedin.com/WboUhagvat1479839504.aspx,Job Hunting,start opening required skills experience develop equivalent experience job resume sales interface part-time part-time develop industry resume responsibilities dynamic responsibilities management required on-time opening multiple required job start required multiple concepts develop sales expert sales opening management customer technologies process opening on-time multiple compensation starter contribute skills resume customer multiple develop on-time engineer visual dynamic self team process contribute benefits
http,{W0X7-P8KO13TT-6014REFF},07/28/2010 13:31:50,MDS0680,PC-9688,http://lockheedmartin.com/WboUhagvat1636367808.htm,Job Hunting,degree growth skills strong report permanent benefits responsibilities concepts dynamic compensation analyze analyze responsibilities job multitask sales part-time compensation interface platform management visual guidance experience multiple customer on-time develop multiple part-time interface report required passion multitask growth people team self
http,{I7T9-R5QA88ZX-8850SONT},07/28/2010 13:38:49,MDS0680,PC-9688,http://lockheedmartin.com/WboUhagvat1636367808.htm,Job Hunting,required skills equivalent dynamic on-time experience responsibilities part-time required management opening years resume people benefits passion multiple concepts on-time team equivalent multitask resume technologies opening on-line job sales concepts opening initiative concepts team
http,{A2M5-B3MB25ZG-9910SMCF},07/28/2010 15:52:30,MDS0680,PC-9688,http://lockheedmartin.com/WboUhagvat1636367808.htm,Job Hunting,permanent concepts responsibilities starter required permanent team skills salary interface degree dynamic required industry dynamic opening start engineer self resume required opening start required interface resume growth management people permanent start team guidance start report initiative salary interface opening guidance passion industry process develop degree opening growth responsibilities passion develop job on-time benefits develop required
