http,{B3T3-H0FM21UV-6098RFOJ},07/28/2010 15:53:56,MDS0680,PC-9688,http://linkedin.com/WboUhagvat1479839504.aspx,Job Hunting,opening skills degree opening required resume interface multitask multiple process develop develop people process multiple contribute growth team years degree passion skills equivalent growth multitask degree benefits required degree platform years analyze customer concepts team platform guidance initiative customer benefits opening concepts multitask platform customer multitask customer required develop start
http,{J2U9-W5OG72EE-6683NWYQ},07/28/2010 17:18:07,MDS0680,PC-9688,http://northropgrumman.com/WboUhagvat572113271.aspx,Job Hunting,skills resume self multitask growth platform report skills degree resume interface salary resume multiple sales strong strong benefits permanent equivalent team job responsibilities benefits degree technologies starter industry dynamic required responsibilities salary benefits strong responsibilities strong industry expert sales
http,{O8Z3-C9BO11GP-7623GOUW},07/29/2010 08:40:18,MDS0680,PC-9688,http://jobhuntersbible.com/WboUhagvat1258877042.aspx,Job Hunting,team initiative hours strong experience dynamic years job multiple opening concepts responsibilities skills process opening experience expert strong platform degree strong interface industry starter salary benefits part-time opening years skills experience initiative multitask responsibilities required on-line industry on-time resume years opening team start process contribute concepts benefits compensation equivalent skills required benefits required self start contribute
http,{V8Y5-K4SG43FT-4732OYKR},07/29/2010 09:29:15,MDS0680,PC-9688,http://lockheedmartin.com/WboUhagvat1636367808.htm,Job Hunting,concepts experience benefits equivalent equivalent dynamic call experience multiple hours contribute expert opening responsibilities experience resume platform resume permanent develop compensation team resume required job start growth opening multiple multiple skills skills relocation initiative skills experience team compensation salary technologies customer management guidance responsibilities team contribute expert industry initiative growth
http,{L5J3-S5XQ77VQ-5011MDHI},07/29/2010 10:53:42,MDS0680,PC-9688,http://lockheedmartin.com/WboUhagvat1636367808.htm,Job Hunting,skills job interface develop initiative required technologies resume concepts part-time equivalent years part-time degree strong equivalent compensation dynamic skills guidance management guidance passion experience degree dynamic team analyze dynamic permanent technologies report hours degree degree platform strong responsibilities multiple responsibilities multiple responsibilities team permanent
http,{P1P5-M0YO96XB-0115RQWK},07/29/2010 11:02:31,MDS0680,PC-9688,http://yahoo.com/hotjobs/WboUhagvat752138490.php,Job Hunting,initiative team benefits degree contribute skills expert growth develop visual degree skills platform management industry sales multiple growth multiple responsibilities required passion permanent contribute industry concepts resume dynamic multitask start platform technologies customer on-line part-time initiative benefits experience skills permanent report equivalent contribute team years industry permanent technologies equivalent multitask
http,{I5Q3-N6BQ17VK-7269XVBB},07/29/2010 12:42:12,MDS0680,PC-9688,http://jobhuntersbible.com/WboUhagvat1258877042.aspx,Job Hunting,develop starter platform contribute develop start expert sales experience report on-time people job develop customer job multiple report call experience platform dynamic growth develop customer resume team contribute multitask benefits start strong job job degree industry experience contribute multitask resume people multiple develop growth years experience dynamic develop job contribute multitask guidance engineer equivalent technologies equivalent skills dynamic platform years years multiple expert compensation develop analyze permanent experience contribute opening management analyze equivalent multitask degree growth experience multiple skills interface
http,{W8U4-V7EP99XT-3037GZJA},07/29/2010 15:42:49,MDS0680,PC-9688,http://lockheedmartin.com/WboUhagvat1636367808.htm,Job Hunting,contribute hours people multitask on-line opening start industry skills multiple process benefits analyze
http,{H6U4-U5QU82MB-7092BSCK},07/29/2010 16:38:18,MDS0680,PC-9688,http://jobhuntersbible.com/WboUhagvat1258877042.aspx,Job Hunting,platform process degree opening on-time customer team degree technologies job passion years guidance platform visual skills years resume customer skills resume multiple recruiter platform experience start expert skills equivalent dynamic self passion multitask platform strong management people on-time contribute required team dynamic compensation benefits technologies contribute platform resume years develop resume interface degree analyze job relocation opening multiple degree opening required required initiative develop sales
http,{G9X0-G4OV36CR-3835BNSV},07/29/2010 17:13:29,MDS0680,PC-9688,http://lockheedmartin.com/WboUhagvat1636367808.htm,Job Hunting,multitask guidance self guidance dynamic initiative industry guidance engineer on-line experience dynamic self concepts expert years industry platform required hours equivalent starter develop strong concepts opening recruiter develop starter skills hours sales initiative experience customer
email,{J9E5-E6QA06CG-5821VKAO},07/30/2010 09:49:54,MDS0680,PC-9688,Jayme.R.Garza@boeing.com,,,Melodie.Denise.Sykes@dtaa.com,Send,21848,,Job Hunting,skills multiple responsibilities required start starter resume sales analyze technologies strong team job resume self skills multitask management dynamic years sales starter self growth growth resume start contribute customer required resume benefits develop job visual years compensation develop years platform contribute skills resume required opening responsibilities dynamic initiative sales start job technologies dynamic concepts equivalent resume on-time multiple report concepts initiative equivalent years resume
http,{J4X6-O3DE90VN-5754MEQY},07/30/2010 10:03:41,MDS0680,PC-9688,http://yahoo.com/hotjobs/WboUhagvat752138490.php,Job Hunting,part-time concepts experience skills platform interface resume analyze team experience strong degree people sales skills skills multitask salary hours experience initiative multitask responsibilities sales resume responsibilities equivalent contribute multiple management passion process skills concepts sales sales self equivalent people permanent compensation skills resume years start people customer engineer equivalent experience compensation equivalent
http,{G6R6-P7YC41IE-1075SFKU},07/30/2010 11:00:13,MDS0680,PC-9688,http://lockheedmartin.com/WboUhagvat1636367808.htm,Job Hunting,concepts start permanent analyze equivalent growth permanent call required compensation part-time job equivalent resume skills relocation self strong platform compensation strong salary people degree degree resume sales self opening degree dynamic skills strong guidance industry opening responsibilities strong passion sales multiple report sales permanent contribute experience equivalent years benefits resume
http,{P7O7-A1BA21HZ-4256JPIJ},07/30/2010 11:07:51,MDS0680,PC-9688,http://monster.com/WboUhagvat1180707852.html,Job Hunting,required team skills self dynamic people develop expert multitask initiative multitask required permanent equivalent dynamic industry skills management dynamic interface develop sales responsibilities contribute years expert resume permanent develop management strong initiative hours equivalent platform benefits dynamic analyze resume growth experience multiple benefits people analyze on-time self customer
http,{Y0Q6-Z1SE97BI-9472MZUG},07/30/2010 14:02:17,MDS0680,PC-9688,http://simplyhired.com/WboUhagvat57469130.jsp,Job Hunting,degree compensation interface responsibilities on-time growth dynamic salary engineer start interface multitask hours multiple people required industry opening start opening develop industry part-time report customer team customer dynamic start job experience analyze technologies start degree equivalent people skills job strong required required permanent initiative multiple passion resume management engineer team
http,{J6M2-N0PQ53GX-1807YWQV},07/30/2010 16:54:41,MDS0680,PC-9688,http://jobhuntersbible.com/WboUhagvat1258877042.aspx,Job Hunting,permanent technologies degree strong experience technologies platform strong resume start permanent experience customer resume growth develop people experience multitask equivalent resume interface dynamic required degree start technologies on-line required people team strong technologies equivalent starter experience report customer interface
email,{B0F9-W7UG08QG-4341AMLQ},08/02/2010 08:16:11,MDS0680,PC-9688,Jayme.R.Garza@boeing.com,,,Melodie.Denise.Sykes@dtaa.com,Send,32862,,Job Hunting,job equivalent report multiple multitask report responsibilities multiple benefits team required multiple relocation technologies job multitask people platform strong required people visual responsibilities strong salary team multiple years job degree skills initiative people passion responsibilities engineer multitask skills sales job skills multitask equivalent develop opening develop
http,{R9Q3-Y0CL89XE-0713YPBW},08/02/2010 08:17:21,MDS0680,PC-9688,http://lockheedmartin.com/WboUhagvat1636367808.htm,Job Hunting,contribute customer contribute initiative concepts self multiple multitask technologies resume growth start analyze growth technologies analyze develop expert customer skills strong degree team interface multiple on-line contribute process platform benefits multitask analyze multiple customer develop resume sales platform equivalent people multitask years skills customer management growth equivalent multiple self sales management analyze dynamic
http,{B8M0-D4OE48XK-4209WLHA},08/02/2010 08:59:21,MDS0680,PC-9688,http://lockheedmartin.com/WboUhagvat1636367808.htm,Job Hunting,part-time customer visual responsibilities industry process start salary guidance resume expert strong multiple equivalent required self start industry concepts degree customer responsibilities degree sales equivalent industry industry team develop start technologies sales strong expert develop starter contribute multiple required hours compensation on-time strong strong platform benefits expert skills benefits job part-time job team process on-line
http,{I8F6-P3MK32GI-5145BCAE},08/02/2010 09:43:46,MDS0680,PC-9688,http://lockheedmartin.com/WboUhagvat1636367808.htm,Job Hunting,develop customer permanent recruiter growth guidance interface start relocation required recruiter on-line develop skills report start platform on-time compensation skills opening required industry resume responsibilities start equivalent process hours experience permanent analyze multitask analyze salary experience opening people benefits opening initiative management team job multiple interface skills multiple concepts initiative multiple resume initiative resume
email,{E2D0-G6LQ37EO-5855NQLO},08/02/2010 10:15:04,MDS0680,PC-9688,Jayme.R.Garza@boeing.com,,,Melodie.Denise.Sykes@dtaa.com,Send,28136,,Job Hunting,resume guidance permanent concepts required platform start contribute responsibilities industry start equivalent develop responsibilities resume customer platform develop develop dynamic job people people required concepts years job passion call multiple skills on-time concepts opening salary resume years expert years expert strong hours
http,{V8V8-V9CT72RV-4056ZKNR},08/02/2010 11:32:21,MDS0680,PC-9688,http://lockheedmartin.com/WboUhagvat1636367808.htm,Job Hunting,degree on-line equivalent customer job team benefits opening people degree degree responsibilities guidance report responsibilities years passion industry sales analyze report multitask develop management multitask multiple strong sales process visual guidance start analyze industry on-time multiple concepts skills team customer people strong opening
http,{O3L0-F7TE07MO-7822GPVB},08/02/2010 13:11:56,MDS0680,PC-9688,http://linkedin.com/WboUhagvat1479839504.aspx,Job Hunting,on-line visual experience on-time multitask experience years resume develop management experience experience multitask experience permanent job responsibilities responsibilities team management report job industry
email,{N4Y0-E0TZ39DY-7446XRDC},08/02/2010 14:47:10,MDS0680,PC-9688,Jayme.R.Garza@boeing.com,,,Melodie.Denise.Sykes@dtaa.com,Send,39707,,Job Hunting,process interface growth customer concepts job dynamic skills sales dynamic passion initiative part-time experience growth passion years initiative expert report multiple initiative team required contribute team strong part-time technologies platform years resume dynamic equivalent equivalent customer resume required experience customer analyze equivalent experience expert benefits management
http,{K7Q5-P6ZZ71MA-4436DSIC},08/02/2010 14:50:43,MDS0680,PC-9688,http://lockheedmartin.com/WboUhagvat1636367808.htm,Job Hunting,initiative engineer resume skills opening concepts skills platform strong sales report on-time resume analyze interface job interface passion industry multitask responsibilities platform experience guidance team skills interface visual skills interface required multiple customer on-time concepts management process multitask team experience permanent platform expert skills required benefits report initiative degree opening interface opening develop multiple skills job management
http,{E2Z4-D1YX77ZA-0592FDBX},08/02/2010 14:57:35,MDS0680,PC-9688,http://monster.com/WboUhagvat1180707852.html,Job Hunting,multiple develop permanent resume management expert benefits customer call skills report required starter concepts visual years equivalent customer required hours on-time strong hours opening opening develop equivalent benefits years customer hours responsibilities industry equivalent self experience interface skills on-time management passion skills
http,{X6M9-W9TQ21DD-9629ZPVR},08/02/2010 16:50:54,MDS0680,PC-9688,http://lockheedmartin.com/WboUhagvat1636367808.htm,Job Hunting,report required initiative customer start process customer team initiative experience start responsibilities years strong degree self experience job team develop management multiple visual team hours compensation customer multiple strong years engineer job multitask dynamic strong strong self degree equivalent platform initiative guidance platform management resume job passion industry skills skills opening people experience industry customer contribute management team develop start multiple
http,{W8F7-C4OE72QG-8284ABXC},08/03/2010 10:14:21,MDS0680,PC-9688,http://lockheedmartin.com/WboUhagvat1636367808.htm,Job Hunting,industry multitask technologies required equivalent start multiple benefits strong strong skills resume benefits recruiter customer process report multiple team on-time benefits platform industry responsibilities responsibilities starter experience salary part-time multiple years call industry initiative years analyze resume salary required on-time required industry contribute job
http,{X5O0-F6JI98QM-6032RVPQ},08/03/2010 14:30:35,MDS0680,PC-9688,http://monster.com/WboUhagvat1180707852.html,Job Hunting,years visual passion people sales platform multitask strong skills responsibilities customer experience platform part-time benefits resume sales team growth benefits passion report contribute equivalent dynamic multiple responsibilities visual on-line develop required benefits team passion responsibilities responsibilities hours industry contribute passion strong part-time resume process contribute on-time sales management years growth required multiple platform team skills team salary required part-time
http,{K5V7-F6HJ74FT-3924GWHY},08/03/2010 14:41:18,MDS0680,PC-9688,http://jobhuntersbible.com/WboUhagvat1258877042.aspx,Job Hunting,process equivalent customer interface visual years multiple resume permanent strong concepts develop sales passion experience multiple dynamic management equivalent initiative equivalent visual permanent skills experience team contribute resume experience equivalent resume skills responsibilities experience expert visual industry resume skills people growth visual sales job required develop job required sales strong benefits develop dynamic people dynamic customer team degree engineer starter develop experience permanent benefits
http,{F2L0-K2PE37LD-0001WWJQ},08/03/2010 15:24:44,MDS0680,PC-9688,http://lockheedmartin.com/WboUhagvat1636367808.htm,Job Hunting,growth team responsibilities strong concepts initiative contribute opening on-time guidance responsibilities compensation passion required experience self resume on-time sales sales multiple equivalent responsibilities growth permanent benefits industry dynamic sales growth industry starter compensation equivalent platform benefits skills degree degree compensation strong part-time start salary degree people multitask technologies team customer degree develop platform guidance
http,{G8L1-B7WE44BN-3327GIUO},08/03/2010 16:31:16,MDS0680,PC-9688,http://monster.com/WboUhagvat1180707852.html,Job Hunting,resume equivalent analyze people passion customer team call degree on-time growth opening customer contribute growth concepts job passion contribute passion equivalent years required responsibilities dynamic contribute responsibilities benefits opening benefits expert customer skills management strong required multiple interface start multiple hours technologies passion people concepts years guidance job report initiative technologies customer strong technologies customer sales resume
http,{M2Y2-R8FD32VD-5197YVFG},08/04/2010 08:05:46,MDS0680,PC-9688,http://jobhuntersbible.com/WboUhagvat1258877042.aspx,Job Hunting,benefits degree years sales report develop self equivalent guidance platform interface degree benefits hours experience team passion team contribute industry growth guidance strong growth report team interface strong permanent permanent interface strong process responsibilities salary guidance passion experience start dynamic platform technologies experience contribute dynamic report industry degree skills passion degree strong required
http,{N7N0-P6GZ29PS-6533WOZR},08/04/2010 09:48:28,MDS0680,PC-9688,http://lockheedmartin.com/WboUhagvat1636367808.htm,Job Hunting,years passion guidance required management initiative multitask resume opening engineer on-time dynamic analyze resume people skills technologies management customer team customer degree strong management contribute develop hours report initiative report guidance customer skills strong technologies management develop develop
http,{M4Q1-H5MF72CZ-4942PABT},08/04/2010 14:27:27,MDS0680,PC-9688,http://lockheedmartin.com/WboUhagvat1636367808.htm,Job Hunting,start dynamic platform industry strong skills degree report platform self experience process benefits guidance skills people benefits industry degree analyze develop passion required concepts report hours technologies contribute hours team multiple concepts resume strong part-time job team people job guidance skills on-time team resume customer people management resume report on-time guidance passion skills degree expert on-time customer technologies compensation start interface part-time management concepts experience concepts platform
http,{A0K1-V0HC49UA-8714FMLR},08/04/2010 14:36:55,MDS0680,PC-9688,http://lockheedmartin.com/WboUhagvat1636367808.htm,Job Hunting,contribute analyze people sales on-line required resume required industry team opening resume years on-line on-line sales technologies customer equivalent degree compensation interface opening people hours required dynamic hours contribute sales customer start experience guidance people multitask people resume interface initiative report start years concepts job multitask compensation permanent call team on-time start dynamic analyze job responsibilities sales benefits multitask multiple passion on-line
http,{T3T5-D2PO82XO-0016ULMD},08/04/2010 14:38:00,MDS0680,PC-9688,http://linkedin.com/WboUhagvat1479839504.aspx,Job Hunting,develop equivalent on-time start strong process management required on-line contribute equivalent management people equivalent benefits growth required technologies initiative resume team passion years platform growth equivalent technologies industry equivalent interface multitask platform experience growth skills resume develop experience required required guidance years industry contribute responsibilities guidance required multiple team interface starter guidance skills technologies strong
http,{N6M7-N5VS15QB-6182YYDK},08/04/2010 17:07:54,MDS0680,PC-9688,http://careerbuilder.com/WboUhagvat660170997.htm,Job Hunting,resume contribute platform report develop industry growth multitask degree permanent degree interface passion on-line opening required expert multitask report skills report multiple start hours on-line initiative platform technologies process resume start contribute job management team experience skills job call years develop degree years hours experience resume interface relocation job responsibilities
http,{R1W5-P8IF01CO-9448CPLY},08/04/2010 17:36:04,MDS0680,PC-9688,http://monster.com/WboUhagvat1180707852.html,Job Hunting,initiative initiative contribute resume expert multiple dynamic compensation technologies permanent team on-time required growth customer skills equivalent dynamic contribute guidance sales analyze process required industry management initiative customer concepts dynamic technologies management skills sales platform people skills people
http,{N0G4-Z3WX23TK-0377NNUC},08/04/2010 17:47:44,MDS0680,PC-9688,http://jobhuntersbible.com/WboUhagvat1258877042.aspx,Job Hunting,skills strong management equivalent on-time analyze start resume years experience degree industry analyze team on-time develop multiple experience management management job self opening expert required job expert permanent responsibilities multitask develop develop growth compensation expert team equivalent benefits sales start team salary contribute industry team job industry on-time hours customer required industry guidance equivalent management strong engineer skills
http,{R5P9-K1IB20KO-6341TVGA},08/05/2010 08:55:24,MDS0680,PC-9688,http://monster.com/WboUhagvat1180707852.html,Job Hunting,years develop passion develop initiative on-line initiative engineer dynamic develop required industry permanent permanent responsibilities on-time management skills management years people part-time multiple platform permanent passion develop guidance self process responsibilities develop team expert industry industry required opening technologies opening growth management required skills customer team resume technologies technologies management growth
http,{W1S5-Z3LK42QI-4390GHON},08/05/2010 09:14:43,MDS0680,PC-9688,http://lockheedmartin.com/WboUhagvat1636367808.htm,Job Hunting,analyze degree hours platform degree multiple expert resume contribute sales technologies initiative multiple multitask required resume resume compensation dynamic responsibilities interface required analyze opening part-time team required resume customer process contribute
http,{S0P9-M5GU92OK-9547LPOH},08/05/2010 09:47:44,MDS0680,PC-9688,http://lockheedmartin.com/WboUhagvat1636367808.htm,Job Hunting,recruiter concepts equivalent industry equivalent technologies initiative multiple degree passion multitask strong interface visual platform on-time multiple team self skills equivalent resume process resume part-time guidance responsibilities expert growth on-time team multitask expert expert management start skills multiple develop starter years passion concepts equivalent platform management on-line skills start job technologies team dynamic concepts opening platform
http,{H5D0-E8ZP00WL-8325IUOH},08/05/2010 12:18:17,MDS0680,PC-9688,http://jobhuntersbible.com/WboUhagvat1258877042.aspx,Job Hunting,start experience analyze equivalent customer report sales multiple customer multitask sales team team contribute platform process multiple opening equivalent opening growth required responsibilities initiative guidance part-time growth resume opening analyze team compensation
http,{H4G6-C4RC22JM-9370CYIO},08/05/2010 12:58:17,MDS0680,PC-9688,http://lockheedmartin.com/WboUhagvat1636367808.htm,Job Hunting,permanent self passion degree team opening growth part-time management multiple team experience report start degree process part-time starter concepts concepts team strong equivalent on-time growth recruiter team sales dynamic starter permanent technologies degree growth self experience opening opening platform contribute self responsibilities customer part-time growth platform opening initiative analyze starter management concepts job growth multiple required sales hours team salary
http,{S2G9-F2GL20MU-6839VFRF},08/05/2010 13:21:29,MDS0680,PC-9688,http://jobhuntersbible.com/WboUhagvat1258877042.aspx,Job Hunting,salary multitask years job experience report develop experience degree responsibilities contribute skills multiple on-line skills initiative guidance job initiative degree on-time customer skills customer degree report resume people opening self years benefits dynamic process starter report guidance job sales technologies skills multitask sales visual experience contribute sales hours concepts on-line develop relocation required industry resume passion management experience multiple team start required expert responsibilities multiple
